id,datetime,location,text,rating,accessibility,facility,activity,english_translation,aspects,sentiment,real_aspect
bb48c9069b0d45b48203e0329cc430a7,2019-02-23 18:23:20,Terminal Wisata Grafika Cikole,"Tempatnya luaaass,,adem,sejuk,ditambah ada kabut.ahh cocok banget buat refreshing...saran yaa ga boleh bawa makanan dari luar,jadi klo bekel nasi bisa makan diluar ada tempat nyewa tikar.makan sepuasnya sampe kenyang.soalnya klo jajan didalem mhal bingitsss",5,neutral,positive,neutral,"The place is spacioouus,, cool, fresh, plus there's fog. ahh perfect for refreshing... a suggestion, you can't bring food from outside, so if you have a rice lunchbox, you can eat it outside where there are places to rent mats. eat to your heart's content until you're full. because buying food inside is very expensive","spaciousness, place, food, food, price","positive, positive, negative, positive, negative","spacioouus, places, food, food, food"
5e88b523c6e346f4a38267043c7820a4,2022-02-15 14:13:04,Sanghyang Kenit,"Spot buat poto"" nya keren htm nya cuma 5K parkir motor 2K bisa langsung ke lokasi kalo buat mobil parkir di atas jalan nya deket. Pernah pertama kesini ditutup soalnya aliran air dari bendungan diarahkan ke Sanghyang kenit jd hanya bisa liat dari atas aja .",5,positive,neutral,positive,"The photo spots are cool, the entrance fee is only 5K, motorcycle parking is 2K, you can go directly to the location. If you're coming by car, park on the street, it's close. The first time I came here, it was closed because the water flow from the dam was directed to Sanghyang Kenit, so I could only see it from above.","photo, ticket, parking, location, parking, water, location","positive, positive, positive, positive, positive, negative, neutral","photo, fee, parking, location, street, water, above"
9142c739674c444b97468f8958f44ed5,2019-02-15 13:48:38,Curug Maribaya,"Curug ini ada dua tempat air terjun, di pintu masuk ada beberapa kedai makanan,begipula di dalam area curug,biaya tiket masuk 25rb/orang dan bisa di tukarkan dengan kue pay/minuman,didalam curug ada beberapa spot foto serta rumah hobbit dan kandang domba...",5,neutral,neutral,positive,"This waterfall has two waterfall spots. At the entrance there are several food stalls, as well as within the waterfall area. The entrance ticket costs 25 thousand per person and can be exchanged for a pie/drink. Inside the waterfall, there are several photo spots, as well as hobbit houses and a sheep pen.","place, spot, entrance, food, price, drink, photo, attraction, attraction","positive, positive, neutral, positive, neutral, positive, positive, positive, positive","waterfall, spots, entrance, food, ticket, drink, photo, houses, pen"
3da5a1563f834e25b2f2419003744139,2021-02-15 14:05:06,Curug Layung Camp Situ Lembang,"Mencari udara seger adanya disini, dikelilingi pohon pinus dan view perkebunan teh, suasana disini sangat sejuk dan udara seger, untuk keluarga dan rombongan untuk menghilangkan rasa lelah dan jenuh tempatnya disini, lingkungan cukup bersih, seperti toilet.",5,neutral,positive,positive,"Seeking fresh air is here, surrounded by pine trees and tea plantation views, the atmosphere here is very cool and the air is fresh, for families and groups to relieve fatigue and boredom, the place is here, the environment is quite clean, like the toilets.","air, view, atmosphere, air, place, cleanliness, restroom","positive, positive, positive, positive, positive, positive, positive","air, views, atmosphere, air, place, clean, toilets"
09dabb587ea14d10b460e8cbd71cf459,2020-02-15 13:29:23,Stone Garden,"Pemandangannya bagus, asri, awas kalo kalian buang sampah jgn sembarangan yah, love nature, Dan hati2 juga saat selfie karma Ada tempat yg kalo gak  hati2 bisa fatal akibatnya, hati2 tergelincir juga, batu2kecilnya agak tajam2,be careful if take ur children",5,neutral,neutral,positive,"The view is beautiful and lush, be careful not to litter carelessly, love nature, and also be careful when taking selfies because there are places that can be fatal if you're not careful. Be careful of slipping too, the small stones are a bit sharp.","view, nature, place, safety","positive, positive, negative, negative","view, nature, places, slipping"
1dbb224ead3e4911a79fb0616dd988b9,2019-02-15 11:58:53,Curug Malela,"Berlokasi di Desa Cicadas, Gunung Halu, air terjun ini mengalir dalam 5 jalur, menghasilkan pemandangan yang megah dan memikat.

Air terjun ini masih satu rangkaian dengan Curug Katumiri, Manglid, Ngebul, Sumpel, Palisir, dan Pameungpeuk.

Tarif: Rp10.000,00",5,neutral,neutral,neutral,"Located in Cicadas Village, Gunung Halu, this waterfall flows in 5 streams, creating a magnificent and captivating view.

This waterfall is still part of the same series as Curug Katumiri, Manglid, Ngebul, Sumpel, Palisir, and Pameungpeuk.

Entrance Fee: Rp10,000.00","location, view, ticket","positive, positive, neutral","Cicadas Village, view, Entrance Fee"
e219b1d81b454a2084e1371691e18113,2022-08-23 17:57:45,Floating Market Lembang,"Pertama kesini awal pembukaan dan hampir tiap sabtu dan minggu kesini, msh sepi dan sengaja cari hotel yg dkt sini biar minggu paginya bs olah raga disini.. Dan berjalan waktu ternyata tambah rame dan tambah banyak arena lain... Makanan nya pun tambah banyay",5,neutral,neutral,neutral,"First came here at the opening and almost every Saturday and Sunday came here, still quiet and intentionally looked for a hotel nearby so that on Sunday mornings could exercise here. And as time went on, it turned out to be more crowded and more other attractions... The food also increased a lot.","quietness, crowd, activity, food","positive, negative, neutral, positive","quiet, crowded, attractions, food"
a67c353652b748efba21ac6f03f21899,2023-01-26 17:57:54,Floating Market Lembang,"11 Juli 2017
Destinasi wisata di Lembang, perlu di tingkatkan sarana wisatanya,  2 jam waktu tempuh dgn jarak 7 KM dari kota Bandung membuat tidak nyaman

28 December 2022
Kedua kali ketempat wisata ini dan sudah banyak perubahan dan penambahan sarana wisata",4,neutral,neutral,neutral,"July 11, 2017
Tourist destinations in Lembang need to improve their tourism facilities; a 2-hour travel time for a distance of 7 KM from Bandung city makes it uncomfortable.

December 28, 2022
Second time at this tourist spot, and there have been many changes and additions to the tourism facilities.","facility, facility","negative, negative","facilities, travel"
41f15da2a1c644e7a38c5afca78265d5,2019-02-23 17:58:16,Floating Market Lembang,"Lahan luas, tertata dengan baik, tiket masuk 20.000 bisa ditukar dengan minuman. Harga harga jajanan relatif murah. Recommended banget untuk orang-orang yang lagi berlibur di Bandung. Weekend tidak pernah sepi, malah sering ga kebagian tempat parkir. Mantapp",5,neutral,positive,neutral,"Spacious grounds, well-maintained, entrance ticket of 20,000 can be exchanged for a drink. Snack prices are relatively cheap. Highly recommended for people on vacation in Bandung. Weekends are never quiet, in fact, parking spots are often unavailable. Great!","spaciousness, maintenance, ticket, drink, price, crowd, parking","positive, positive, neutral, positive, positive, negative, negative","grounds, maintained, ticket, drink, prices, weekends, parking"
b0d57a4c61b041ce97c8d38eeca20f84,2022-02-23 18:22:12,Terminal Wisata Grafika Cikole,"Indah bgt tempatnya, cocok buat rekreasi atau ngecamp ceria bareng keluarga karna tersedia penginapan juga didalam. Kebetulan kemarin kesana pas weekday jadi sepi bgt berasa grafika milik berdua hehe. Dan yang paling buat nyaman staf grafikanya ramah² bgt ☺️",5,neutral,positive,positive,"The place is very beautiful, suitable for recreation or a cheerful camping trip with family because there are also accommodations inside. Coincidentally, I went there on a weekday, so it was very quiet, felt like Grafika was ours alone hehe. And what made it most comfortable were the very friendly staff at Grafika ☺️","place, accommodation, quietness, staff","positive, positive, positive, positive","place, accommodations, quiet, staff"
318b30d542044dab881f54167d0b11d8,2022-05-15 13:04:21,Taman Lembah DEWATA,Kesana waktu taun 2019 an htm murah terus adem danau nya juga baguss spot foto nya juga bagus cuman waktu kesana lagi masi tahap pembangunan yaa tapi tetep bagus ada nuansa ala ala bali nya juga hehehe recomended temen2 juga udah saya rekomenin datang kesana,3,neutral,neutral,positive,"There in 2019, the entrance fee was cheap, it was cool, the lake was also nice, the photo spots were also good. It was still under construction when I went, but it was still good, it had a Bali vibe too, hehehe. Recommended, I've already recommended it to my friends to come here.","entrance, price, lake, spot, atmosphere","positive, positive, positive, positive, positive","entrance, fee, lake, spots, vibe"
18e6ba47c6ea423486e21a6e6396abdd,2021-02-15 13:29:13,Stone Garden,"Ini tempat meuni ""Wa'as"" kalo bahasa sundanya, hehe.. biasa dipakai prewedding juga, angin nya sejuk karena di dataran tinggi, cuma ada banyak monyet liar disana.. tapi cukup aman kok, hanya saja untuk lebih berhati hati dan diusahakan jangan kontak langsung",5,neutral,neutral,positive,"This place is really ""Wa'as"" in Sundanese, hehe.. it's usually used for pre-weddings too, the wind is cool because it's in a highland, there are just a lot of wild monkeys there.. but it's quite safe, just be extra careful and try not to make direct contact","place, crowd, safety","positive, positive, negative","place, wind, monkeys"
928fd196836e43ea891c1220a18c1905,2022-02-15 13:23:03,Gunung Putri Lembang,"Lokasinya enggak jauh dari kota, tepatnya di Lembang, Kabupaten Bandung Barat, Jawa Barat.

Pendakian ke puncaknya pun enggak makan banyak waktu, cuma 30 menit. Meski begitu, semua pengunjung akan mendapatkan pemandangan matahari terbit yang indah dari sana.",5,positive,neutral,positive,"The location isn't far from the city, specifically in Lembang, West Bandung Regency, West Java.

The hike to the summit also doesn't take much time, only 30 minutes. Despite that, all visitors will get a beautiful sunrise view from there.","location, activity, view","positive, positive, positive","location, hike, view"
38ba817c15bd4d3eb6c1b80aab8e5980,2022-07-15 12:24:47,Curug Tilu Leuwi Opat,"Amazing untuk alamnya airnya bening tempatnya juga lumayan bersih cuma 1 yang bikin saya kecewa banget mba penjaga tiketnya saya nanya baik2 malah nyolot bikin emosi 😒 kalau orang nanya kan krn ga tau, mbanya yang ramah dong jelasinya ga usah pake nyolot 👎👎👎",1,neutral,negative,positive,"Amazing for its nature, the water is clear, the place is also quite clean, only 1 thing that made me very disappointed, the ticket attendant, I asked nicely but she was rude and made me angry 😒 if people ask it's because they don't know, you should explain kindly, no need to be rude 👎👎👎","nature, water, place, cleanliness, ticket, staff","positive, positive, positive, positive, negative, negative","nature, water, place, clean, ticket, attendant"
d90f22d58d11499589c4f64ec7784d28,2022-02-15 21:10:54,Curug Halimun,"Sudah yg ke sekian kali nya berkunjung, sampai sampai si akang guide nya dah hapal betul dgn muka ini..ahaaa
Harus lebih banyak dibuat pengaman di setiap jalan yg bersebelahan dengan jurang saja, lain lain nya biarkan sesuai kehendak alam dan apa ada nya..🙏 …",5,neutral,neutral,neutral,"This is the umpteenth time visiting, even the guide knows my face by heart... ahaaa.
More safety barriers should be built on every path adjacent to a cliff, let the rest be according to nature's will and as it is.. 🙏 …","guide, safety, path, nature","neutral, negative, negative, positive","guide, safety, path, nature"
5d0fef7d9d134fb8b0ff5d9e3a69b83d,2022-02-15 14:05:01,Curug Layung Camp Situ Lembang,"Lokasi mudah di cari dekat dengan Dusun Bambu daerah Lembang. Harga tiket masuk terjangkau. Tempat nya bersih  cocok untuk berwisata outdoor bersama keluarga.
Akses jalan masuk masih berbatu. Air terjun nya jernih dan sejuk. Banyak spot menarik untuk berfoto.",4,positive,positive,positive,"The location is easy to find, near Dusun Bambu in the Lembang area. The entrance fee is affordable. The place is clean and suitable for outdoor recreation with family.
The access road is still rocky. The waterfall is clear and cool. There are many interesting photo spots.","location, entrance, place, road, water, photo","positive, positive, positive, negative, positive, positive","location, entrance, place, road, waterfall, spots"
cb8a1e355166497dadfdda4ad2a1ec20,2019-02-15 12:57:24,Kebun Begonia Lembang,"Selalu ada perbaikan dan berubahan tema background buat foto2, jadi tiap kesana selalu ada tempat baru untuk dijadiin destinasi foto. Tiket masuk terbilang murah krna hanya 10rb/org, untuk jenis kamera DSLR, Handycam maupun Drone dikenakan charge sebesar 50rb",3,neutral,neutral,positive,"There are always improvements and changes to the background themes for photos, so every time you go there, there's always a new spot to make into a photo destination. The entrance ticket is considered cheap at only 10,000 IDR per person, while there is a charge of 50,000 IDR for DSLR cameras, Handycam, or drones.","photo, spot, ticket, price","positive, positive, neutral, neutral","photos, spot, ticket, price"
46944b6cf19a4646b9d7d42531ba4f6c,2022-02-23 18:13:00,Ciwangun Indah Camp (CIC),"Bagusssssss tapi Sayang rada creepy karena udh jarang di kunjungin orang, sepertinya faktor ppkm juga, tapi enak sih buat ngadem, paling the best mah hutan pinus sama kebun teh nya, semoga ke depan nya semakin bagus dan semakin nyaman lagi, yuk main ke cic🤗 …",4,neutral,neutral,neutral,"Great, but unfortunately a bit creepy because not many people visit it anymore. It seems like the PPKM factor played a role, but it's nice to cool down. The best parts are the pine forest and the tea garden. Hopefully, it will get even better and more comfortable in the future. Come visit Cic!","crowd, atmosphere, nature, garden, comfort","negative, negative, positive, positive, positive","people, creepy, forest, garden, comfortable"
848f424e2f144221950e18c478053feb,2022-07-23 17:57:16,Floating Market Lembang,"HTM 30rb/orang (usia 2 tahun ke atas diihitung tiket).. lumayan banyak tempat baru, sayangnya mayoritas harus bayar lagi klo masuk. Tempat sholat pria dan wanita sudah dipisah, sayangnya tempat wudhu masih jadi 1. Sebaiknya pengunjung kesini dilarang merokok.",4,neutral,neutral,neutral,"HTM 30k/person (ages 2 and up are charged for a ticket).. quite a lot of new places, unfortunately, the majority require additional payment for entry. The prayer areas for men and women are separated, unfortunately, the ablution areas are still combined. Visitors here should preferably be prohibited from smoking.","ticket, place, restroom, air","negative, positive, negative, negative","ticket, places, ablution, smoking"
8a60dca4ee6b4c29a3c2d9437e06ba97,2021-02-23 18:12:56,Ciwangun Indah Camp (CIC),Saya berkunjung ke curug tilu leuwi opat yg keb lokasinya berdekatan dengan ciwangun indah camp tempat yang lumayan menguras tenaga untuk hiking dan sampai ke curug tilu gais dan berkesempatan juga melihat penampakan tujub bidadari lagi mandi di bawah curug 3,4,neutral,neutral,neutral,"I visited Curug Tilu Leuwi Opat, which is located close to Ciwangun Indah Camp. It's a place that requires a good amount of energy for hiking to reach Curug Tilu, guys. And I also had the chance to see the apparition of seven angels bathing below Curug 3.","place, hiking, nature","neutral, negative, positive","place, hiking, nature"
fdea10fb4808445f8d05413faf7f5140,2020-02-15 12:25:29,Curug Tilu Leuwi Opat,"
Tempat yang bagus untuk berjalan-jalan dan hiking ringan. Dan harga masuknya adalah Untuk 10k @orang dan 5k @mobil (5 okt 19). Tapi tempatnya agak kotor, sedikit tempat sampah dan setiap pengunjung dan penjaga harus ingat untuk menjaga kebersihan tempat itu.",4,neutral,negative,positive,"A nice place for a walk and light hiking. And the entrance fee is 10k per person and 5k per car (Oct 5, 19). But the place is a bit dirty, with few trash cans, and every visitor and guard should remember to keep the place clean.","place, place, place, entrance, facility, cleanliness","positive, negative, neutral, neutral, negative, negative","place, place, place, entrance, trash cans, dirty"
dc2ecb4df3f24de19c0586f80d8cbee8,2021-02-15 13:43:47,Sanghyang Heuleut,"Kalo mau kesini jarak mulai dari tempat parkir lumayan jauh,saha lupa itu tempat parkir teh pintu pertama kalo gak salah,bayar parkir dan helm sekitar 10000ribu dan bayar tiket masuk 10000/15000an per orang,dan bisa menyewa jasa tour gate biar tidak tersesat.",5,neutral,neutral,neutral,"If you want to come here, the distance from the parking lot is quite far. I forgot, the parking lot is the first entrance, if I'm not mistaken. Parking and helmet fees are around 10,000 rupiah, and entrance tickets are 10,000/15,000 per person. You can also hire a tour guide to avoid getting lost.","parking, entrance, parking, ticket, guide","negative, neutral, neutral, neutral, neutral","parking, entrance, parking, tickets, guide"
119e3a87efed4419871a4a22c7a9c07d,2022-02-15 12:39:07,Sarae Hills,Pemandangannya indah banget... Banyak spot spot foto kayak berasa keliling dunia...mba mba dan mas masnya ramah dn dengan senang hati mau motoin kita.. keren lah..sayang belum semua jadi bngunannya..mungkin nanti.bakal lebih meriah dan bnyak lagi spot fotonya,4,neutral,positive,positive,"The view is really beautiful... Lots of photo spots, it feels like traveling around the world... The ladies and gentlemen there are friendly and happy to take photos for us... it's cool... It's a shame not all the buildings are finished yet... maybe later it will be more festive and have even more photo spots.","view, spot, staff, photo, attraction, spot","positive, positive, positive, positive, neutral, positive","view, spots, ladies, photos, buildings, spots"
f0d5097bd4ac4a95b90a92bc676b07be,2022-02-23 17:57:12,Floating Market Lembang,Cocok untuk liburan berasama keluarga maupun sahabat. Tempatnya luas. Ada beberapa tempat yg kalo mau masuk bayar lagi salah satunya kota mini. Kalo mau murah lebih baik include semua wahana yg ada. Kalo mau masuk floating markernya saja harga tiketnya 30.000,5,neutral,positive,neutral,"Suitable for holidays with family or friends. The place is spacious. There are some places where you have to pay again to enter, one of them is the mini city. If you want it to be cheap, it's better to include all the existing rides. If you only want to enter the floating market, the ticket price is 30,000.","place, spaciousness, ticket, price","positive, positive, negative, neutral","place, spacious, ticket, price"
075711d01e7e45d2a1f59db01e28871a,2020-02-15 13:48:38,Curug Maribaya,"Bayar tiket masuk per orang 35 ribu update per tanggal 03 Agustus 2019.

mengecewakan, Airnya tidak jernih, pelayanan tdk memuaskan, kebersihan tempat wisata tidak di jaga dengan baik oleh staff karyawan maribaya nya. Saya harap pelayanan nya lebih baik lagi.",2,neutral,negative,negative,"Entrance ticket per person is 35 thousand, updated as of August 3, 2019.

Disappointing, the water is not clear, the service is unsatisfactory, the cleanliness of the tourist spot is not well maintained by the Maribaya staff. I hope the service will be better.","ticket, water, service, cleanliness, spot, staff","neutral, negative, negative, negative, negative, negative","ticket, water, service, cleanliness, spot, staff"
90a3cd4679e34ba7b583286d32bd51f3,2019-02-15 13:23:12,Gunung Putri Lembang,"Tempatnya sudah pasti sejuk, nyaman kalau buat camp, naik keatasnya juga bentar sekitar 15menitan. Ada benteng belandanya juga, diatas ada 2 toilet, tapi 2 2nya kadang susah air dan bau. Kalau kebelet bgt harus turun ketoilet deket parkiran yg ada warung2nya.",4,neutral,negative,neutral,"The place is definitely cool and comfortable for camping, and it only takes about 15 minutes to get up. There's also a Dutch fort. Upstairs there are two toilets, but both of them sometimes have water issues and smell bad. If you really have to go, you have to go down to the toilet near the parking lot with the small shops.","place, opening_hours, facility, restroom, restroom, parking","positive, positive, positive, negative, negative, positive","place, minutes, camping, toilets, them, parking"
7f168b71fdd747c7b117175c150e4282,2021-02-15 14:15:30,Bukit Senyum,"wisata alam yang belum terjamah di Bandung Barat

Sebelum masuk hutan pinus ada pos tiket + portal tapi tidak ada orang yg jaga (sewaktu saya ke sana)

Penjaga tiket berada di dalam hutan skitar 500meter dr portal dimana ada warung2 jual makanan di sekitarnya",3,neutral,positive,neutral,"Untouched natural tourism in West Bandung

Before entering the pine forest, there was a ticket post + portal but no one was guarding it (when I went there)

The ticket keeper was inside the forest about 500 meters from the portal, where there were warungs selling food nearby.","ticket, staff, food","neutral, neutral, neutral","ticket, keeper, food"
0007deb9aeda4276802fa4ff85a1d3ca,2022-11-15 21:07:29,Curug Panganten,"Curug Yang Sangat Indah Dan Air Nyapun Sangat Jernih..
Akses Jalan Nya Pun Ga Terlalu Sulit
Bawa Keluarga Pun Aman..
Dan Jangan Lupa Tetap Jaga Kebersihan Nya
Bawa Sampah Nya Pulang Ya Terima Kasih asih.. Lestari Kan Alam Biar Anak Cucu Kita Bisa Menikmatinya",5,neutral,neutral,positive,"A very beautiful waterfall with very clear water.
The road access is not too difficult either.
Safe to bring the family.
And don't forget to keep it clean.
Please take your trash home. Thank you. Preserve nature so that our children and grandchildren can enjoy it.","water, road, safety, cleanliness, nature","positive, positive, positive, positive, positive","water, road, safe, clean, nature"
59d5823580104f14bb9e19fc1e5fd4d0,2019-02-15 12:57:11,Kebun Begonia Lembang,"Kebun yang indah, berbagai jenis bunga ada disini, pelataran kebun cukup luas, untuk berphoto ria atau selfie, view telah disiapkan untuk photo, bunga yang aneka warna menambah serunya photo, mau beli bunga atau hasil kebun bisa disini, lokasi cukup strategis",4,neutral,neutral,positive,"A beautiful garden, various types of flowers are here, the garden grounds are quite spacious, for taking photos or selfies, views have been prepared for photos, the multicolored flowers add to the excitement of the photos, you can buy flowers or garden produce here, the location is quite strategic","garden, spaciousness, photo, location","positive, positive, positive, positive","garden, grounds, photos, views"
acfda3c3f2044fd5b5feaf676bd3ba54,2020-02-15 13:48:38,Curug Maribaya,"Tempat rekreasi balik ke alam yang sangat cocok untuk keluarga, di dalam banyak tempat untuk selfie instagram, ada juga kolam rendam publik dan private air gunung yg mengandung sedikit belerang, ada tempat bermain anak juga, tempat rekreasi terawat dan bersih",4,neutral,positive,positive,"A very suitable recreational place for families to return to nature, with many spots for Instagram selfies, there are also public and private natural spring pools with a slight sulfur content, there is also a children's playground, the recreational place is well-maintained and clean.","place, nature, spot, water, facility, place, cleanliness","positive, positive, positive, neutral, positive, positive, positive","place, nature, spots, pools, playground, place, clean"
c45e648cd1754d21abb5101dc5e8f9e3,2020-02-23 18:35:04,Orchid Forest Cikole,Tempat wisata menyenangkan untuk keluarga banyak spot foto yang indah dan keren2. Recommended banget. Waktu kesana weekdays jadi untuk foto2 lebih leluasa ga terlalu keganggu yang lain atau antri. Pokok nya keren dan patut di coba kalau yang blm pernah kesana.,5,neutral,neutral,positive,"A fun tourist spot for families with many beautiful and cool photo spots. Highly recommended. Went there on a weekday, so it was more relaxed for taking photos without being bothered by others or having to queue. Anyway, it's cool and worth trying if you haven't been there before.","spot, photo, photo, crowd, queue","positive, positive, positive, neutral, negative","spot, photo, spots, weekday, queue"
3acff662d23d4df5bcb53de993396caa,2021-02-23 18:04:20,Gunung Tangkuban Parahu,"Tempat wisata yang udah terkenal dan tidak diragukan lagi, tiket masuknya 40rb untuk satu orang, perjalanan dari pos masuk ke puncak butuh sekitar 10 menit, pemandangannya indah. Lalu masih ada bau belerang juga. Worth it banget untuk yang belum pernah kesini.",5,neutral,neutral,positive,"A well-known and undoubtedly famous tourist spot. The entrance fee is 40,000 IDR per person. The journey from the entrance post to the summit takes about 10 minutes. The view is beautiful. There's also a sulfur smell. It's really worth it for those who haven't been here before.","spot, entrance, price, entrance, view, air","positive, neutral, neutral, neutral, positive, negative","spot, entrance, fee, entrance, view, smell"
7bd675d3720649ad92a46ac1ca75153b,2019-02-15 12:24:52,Curug Tilu Leuwi Opat,"Curug paling dekat hanya 300m dari pintu masuk. Untuk pergi ke curug paling jauh(curug Tilu), akses jalannya masih belum di tata dengan rapih, kita seperti mengikuti jalur pipa air warga, saat sampai di tempat(curug paling jauh), wisatawan tidak boleh berenang",2,negative,neutral,negative,"The closest waterfall is only 300m from the entrance. To get to the furthest waterfall (Curug Tilu), the access road is not yet neatly arranged, it's like we're following the villagers' water pipe path. When you reach the location (furthest waterfall), tourists are not allowed to swim.","place, road, water, location, attraction","neutral, negative, neutral, neutral, neutral","entrance, road, water, location, waterfall"
