id,datetime,location,text,rating,accessibility,facility,activity,english_translation,aspects,sentiment,real_aspect
878f4e61c157418db1da7b4e82485042,2020-02-23 18:22:37,Terminal Wisata Grafika Cikole,15° C di malam hari bbrrr.. buat yg kangen dengan kesejukan udara & kebisingan kota cocok banget.,5,neutral,neutral,neutral,"15° C at night, brrr.. perfect for those who miss the cool air & city noise.","air, noise","positive, positive","air, noise"
a51db45b14b54f2cb87aec43026c8791,2019-02-23 18:35:10,Orchid Forest Cikole,"Tiket masuk lumayan , di dalam masih ada wahana berbayar juga.
tapi suasananya asri sejuk dingin.",4,neutral,negative,positive,"The entrance ticket is quite reasonable, and there are also paid attractions inside.
But the atmosphere is lush, cool, and refreshing.","entrance, ticket, atmosphere","positive, positive, positive","entrance, ticket, attractions"
bbfd38c1bf55454a828dc25eeca5cde7,2023-01-15 12:39:15,Sarae Hills,Bersama orang orang tercinta menikmati keindahan alam dan lingkungan sekitar yang nyaman dan asri,5,neutral,neutral,positive,Enjoying the beauty of nature and the comfortable and beautiful surroundings with loved ones,"beauty, nature, comfort, atmosphere","positive, positive, positive, positive","beauty, nature, surroundings, surroundings"
83d7797111744cab9c4f0f4d3edfe685,2021-02-15 14:05:09,Curug Layung Camp Situ Lembang,"Mantap, track nya bersahabat untuk anak 4tahun keatas untuk berlatih tracking / hiking singkat...",5,neutral,neutral,positive,"Great, the track is friendly for children 4 years and up to practice short tracking/hiking...","trail, walking","positive, positive","track, hiking"
633ddc45745e4d358fdf23c1367d27f5,2022-07-23 17:57:17,Floating Market Lembang,Tempatnya yg strategis mudah dijangkau.alamnya terasa sejuk dan nyaman.banyak wahana yg tersedia.,5,neutral,neutral,positive,The location is strategic and easy to reach. The nature feels cool and comfortable. There are many rides available.,"location, nature, attraction","positive, positive, positive","location, nature, rides"
c131fcc740134cb8a65249c0e5b305e5,2021-02-15 13:28:46,Stone Garden,"Ini tempatnya enak sekali banyak spot foto seneng kalau kesini, jalanannya nanjak tapi aku senang",5,neutral,neutral,positive,"This place is really nice, lots of photo spots. I'm happy when I come here. The road is uphill but I don't mind.","place, photo, spot, atmosphere, road","positive, positive, positive, positive, neutral","place, photo, spots, here, road"
24d24ee7667a411ca3323d760f57d72a,2022-07-23 18:21:59,Terminal Wisata Grafika Cikole,"Tempatnya adem, tiket masuk 20rb/org...parkir mobil 15rb....
Ada penginapannya juga, dinginnn bgt",4,neutral,positive,positive,"The place is cool, entrance fee is 20k/person... car parking is 15k....
There's also accommodation, very coooold","place, entrance, parking, accommodation, air","positive, negative, negative, positive, negative","place, fee, parking, accommodation, air"
633d0ed686f64da39d4334f1be872fa9,2022-06-23 18:34:12,Orchid Forest Cikole,Siapkan minimal 100k untuk 1 orang kalau mau dapat semua spot karena banyak yg berbayar diluar HTM,5,neutral,neutral,neutral,Prepare at least 100k for 1 person if you want to get all the spots because many are paid outside of the entrance fee,"place, place, entrance","neutral, neutral, neutral","spots, spots, entrance"
dbe8001e1aa64f34a050855e0d208f70,2020-02-15 12:57:10,Kebun Begonia Lembang,"Lumayan buat foto2,tempatnya tdk terlalu luas,dan sepertinya kurang terawat.. weekemd cukup ramai.",5,neutral,neutral,negative,"Not bad for photos, the place isn't too big, and it seems a bit neglected.. weekends are quite crowded.","photo, spaciousness, maintenance, crowd","positive, negative, negative, positive","photos, big, neglected, crowded"
2a3ebb0f3e434f3eaf367b1ff67c1fb0,2022-02-15 14:05:04,Curug Layung Camp Situ Lembang,"pemandangan yang bagus, hawa nya enakkk.. tempat pemilihan camp nya banyak.. ga nyesel pokoknyaaaa",5,neutral,neutral,positive,"Great view, the air is really nice... Lots of camping spots... No regrets, reallyyy","view, air, spot","positive, positive, positive","view, air, spots"
9902ab3b33cb426abace4ea2cc9f8e2a,2019-02-15 13:49:07,Curug Maribaya,"+ Suasana & view alamnya bagus
- Tidak disarankan pulang malam hari karena penerangan jalan minim.",4,negative,neutral,positive,"+ The atmosphere & nature view are good
- It is not recommended to go home at night due to minimal street lighting.","atmosphere, nature, view, place, light, road","positive, positive, positive, negative, negative, negative","atmosphere, nature, view, home, lighting, street"
1de57c38e3dc4b428c1c0e3ffe09ed36,2019-02-15 12:25:01,Curug Tilu Leuwi Opat,"Cocok banget niih buat ngadem disini apalgi camping buat komunitas, kamar mandinya juga banyak 😁 …",5,neutral,positive,positive,"This is a perfect place to cool off here, especially for camping with a community, and there are plenty of bathrooms too 😁","place, place, restroom","positive, positive, positive","place, camping, bathrooms"
287ab6f13a7b479f8e0ce6181c68d6b0,2019-02-15 13:49:09,Curug Maribaya,"Lokasi strategis, tempat aman nyaman menyenangkan panorama bagus edi peni indah asri. Recommended.",5,neutral,neutral,positive,"Strategic location, safe, comfortable, enjoyable place, good panorama, beautiful, natural, lovely. Recommended.","location, safety, comfort, place, view, nature, beauty","positive, positive, positive, positive, positive, positive, positive","location, safe, comfortable, place, panorama, natural, beautiful"
e2e98a9333f146278215356300926784,2020-02-15 12:25:00,Curug Tilu Leuwi Opat,"ya gitu weh, stabdart curug pada umumnya... hehe cmn g terlalu banyak org yg tau tentang curug ini",5,neutral,neutral,neutral,"Yeah, that's how it is, a standard waterfall in general... hehe, it's just that not many people know about this waterfall.","attraction, nature","neutral, neutral","waterfall, waterfall"
1fc1859b36814e3aa5d2230c1fd4ed6b,2022-05-15 12:39:08,Sarae Hills,"Bis tidak rekomended utk akses ke tempat wisata ini,btw tempat bagus utk healing,banyak resto juga",5,negative,neutral,positive,"Not recommended for access to this tourist spot, by the way, a good place for healing, lots of restaurants too","spot, place, restaurant","negative, positive, positive","spot, place, restaurants"
39470c2acbb04d0cb54c36290d664727,2023-01-23 17:57:41,Floating Market Lembang,"Tempat oke, tpi mau main smua permainan serba bayar. Jadi siapkan uang yg buanyak yaadisini hihihi",4,neutral,neutral,positive,"Nice place, but you have to pay for every game. So prepare a lot of money here hehehe","place, price","positive, negative","place, pay"
c4f153196fb14e8198c3aa2355a49682,2021-02-23 18:34:50,Orchid Forest Cikole,Area nya luas ada camping nya juga. Pastikan kalau mau kesini cuacanya mendukung alias tidak hujan,5,neutral,neutral,positive,"The area is spacious, there's also camping. Make sure the weather is favorable, meaning no rain, if you plan to come here.","spaciousness, weather","positive, neutral","area, camping"
0c0cfe5c68fb4ada9e9bab15cb9edc2b,2020-02-15 12:24:59,Curug Tilu Leuwi Opat,"Waktu kesana debit air lagi kurang banyak...
Tapi pemandangannya bagus banget, anak2 bisa main air",4,neutral,neutral,positive,"The water flow was quite low when we went there... but the scenery was really beautiful, and the kids could play in the water.","water, scenery, water","negative, positive, positive","water, scenery, water"
b92c6e2e496d4375aabe6bdb45248692,2022-02-15 14:18:31,Curug Sawer Cililin,"Curug sawer Cililin sekarang walaupun musim hujan, airnya ga terlalu deras. Jalannya aman ga licin",4,neutral,neutral,neutral,"Curug Sawer Cililin, even though it's the rainy season now, the water isn't too strong. The road is safe and not slippery.","water, road","positive, positive","water, road"
a1fe49e0f8b9433caae922872d072684,2022-04-15 14:09:09,Curug Cimahi / Curug Pelangi,"Tangganya mantep, buat yg pisiknya kurang jangan ke sini, bisa bisa bisa turun ga bisa naik/pulang",5,neutral,neutral,neutral,"The stairs are solid/sturdy, for those with poor physique, don't come here, you might be able to go down but not be able to go up/go home.","accessibility, accessibility","negative, negative","stairs, stairs"
e95522e0f8ab4ddd9a81de9c04d0b7b7,2019-02-15 13:23:28,Gunung Putri Lembang,"Belum terlalu ramai, akses jalan ke lokasinya sempit, masih bersih. Lumayan bagus spot sunrise nya",4,negative,positive,positive,"Not too crowded yet, the road access to the location is narrow, still clean. The sunrise spot is quite good.","crowd, road, cleanliness, spot","neutral, negative, positive, positive","crowded, road, clean, spot"
252fec0692a540148e7957bc28fd9add,2022-06-15 12:39:39,Sarae Hills,"Porsinya kecil
Rasa biasa saja
Kalo makanan disini tidak disediakan minuman, jadi harus beli lagi.",2,neutral,negative,neutral,"The portions are small.
The taste is just okay.
Since drinks are not provided with the food here, you have to buy them separately.","food, food, drink","negative, neutral, negative","portions, taste, drinks"
7b2b6d9a1f8f4b61816dfdbefe33f954,2022-09-15 12:39:40,Sarae Hills,"Bagus buat spot foto2,tp mmg blm selesai semua.  Kabarnya tgl 15 jan 2022 dibuka lg spot foto baru",5,neutral,neutral,positive,"Good for photo spots, but not all of it is finished yet. Word is that new photo spots will reopen on January 15, 2022.","photo, spot, spot","positive, neutral, neutral","photo, spots, spots"
2c015d5ed4ac430a8979c4d50f98db9f,2023-01-15 13:04:26,Taman Lembah DEWATA,"Selain harga tiketnya murah, tiket tersebut sudah termasuk free air minum, guys. Merapat!! Ademmmm",5,neutral,positive,positive,"Besides the cheap ticket price, the ticket already includes free drinking water, guys. Come over!! So comfy","price, ticket, drink, water, comfort","positive, positive, positive, positive, positive","price, ticket, drinking, water, comfy"
c2d057ad91ab4dce9b4a71a4f7ef449e,2022-02-15 13:43:43,Sanghyang Heuleut,Perjuangan track menuju lokasi terbayarkan perjuangan setelah sampai di lokasi.. tempat yang indah,5,neutral,neutral,positive,The struggle of the track to the location paid off after arriving at the location.. a beautiful place.,"trail, location, place","negative, positive, positive","track, location, place"
7adbfa6cd2b540339223d3e506cf1895,2020-02-23 18:13:32,Ciwangun Indah Camp (CIC)," Tempat yang bagus dengan pemandangan yang bagus dan bantuan untuk mendirikan kemah dan kegiatan

",3,neutral,neutral,neutral,A great place with a nice view and help setting up camp and activities,"place, view, activity","positive, positive, positive","place, view, activities"
9236ee0d5dcd4370ac5bc7525f542ce6,2022-05-23 18:22:28,Terminal Wisata Grafika Cikole,Tempat yang sangat luar biasa.saya suka banget tempat ini.kalo dekat bisa setiap haei saya kesini.,5,neutral,neutral,neutral,"An amazing place. I really love this place. If it were closer, I could come here every day.","place, place, location","positive, positive, negative","place, place, closer"
52e5abb669d145fa991e7eca840b99ac,2021-02-15 13:49:01,Curug Maribaya,"Harga tiket terjangkau, terbayarkan dengan pemandangan air terjun yang indah. Hawanya masih sejuk.",5,neutral,neutral,positive,"Affordable ticket price, paid off by the beautiful waterfall view. The air is still cool.","ticket, price, view, air","positive, positive, positive, positive","ticket, price, waterfall, view"
2b08bc2330c94ecea82a24f572546413,2019-02-15 14:18:34,Curug Sawer Cililin,"Rekreasi murah, sehat, udara sejuk, fresh, suntuk/stres hilang di tempat ini,...  Curug sawer 😀😍 …",4,neutral,positive,positive,"Cheap recreation, healthy, cool air, fresh, boredom/stress disappears in this place,... Sawer Waterfall 😀😍 …",,,
6640d385f1844cbf85298f8471760680,2022-02-15 13:04:52,Taman Lembah DEWATA,Bagus tempatnya alami...kurang buat kuliner kalau kuliner nya komplit emak emak pasti tambah happy,4,neutral,negative,positive,"The place is naturally beautiful... not much for culinary options. If there were more complete culinary choices, mothers would be even happier.",,,
be5a09c01cfa4e5fad70d0aa877e3116,2022-06-15 11:58:50,Curug Malela,Walau belum pernah kesana lihat dari foto2 sangat indah. Insya Allah dlm waktu dekat kesana Aamiin,4,neutral,neutral,positive,"Even though I've never been there, looking at the photos, it's very beautiful. God willing, I will go there soon, Amen.","beauty, photo","positive, neutral","beautiful, photos"
4b211330462d4744bf2053fa90d4bfb1,2022-08-15 12:39:41,Sarae Hills,"Tempatnya masih baru, ada beberapa spot foto yang bagus, suasana masih terasa panas di siang hari.",1,neutral,neutral,neutral,"The place is still new, there are some good photo spots, the atmosphere still feels hot during the day.","place, photo, atmosphere","positive, positive, negative","place, spots, atmosphere"
54e213797c66498190143709d8ae398b,2019-02-15 13:29:16,Stone Garden,"Tempatnya bagus, dan banyak angin segar cocok untuk sekedar jalan2 pagi ataupun sore dengan santai",4,neutral,neutral,positive,"The place is nice, and there's plenty of fresh air, perfect for a leisurely morning or afternoon stroll.","place, air","positive, positive","place, air"
c238ec95121d4f7ca11c90256a0b523b,2022-05-15 12:39:35,Sarae Hills,Nice n clean place.. Cocok buat yg suka foto2.. Ada petugas d tiap spot yg ramah2 n bantuin foto..,5,neutral,positive,positive,Nice and clean place.. Suitable for those who like to take photos.. There are friendly staff at each spot who help with photos..,"place, photo, staff, spot, photo","positive, positive, positive, positive, positive","place, photos, staff, spot, photos"
0272f97a973d4f589c5bb114bf9b6d47,2022-02-15 12:39:07,Sarae Hills,"Tempatnya luas & keren
Banyak spot foto nya
Pegawai nya juga ramah & baik²
Berasa liburan d LN 😍 …",5,neutral,positive,positive,"The place is spacious & cool
There are many photo spots
The staff are also friendly & kind
Feels like a vacation abroad 😍","place, spot, staff, atmosphere","positive, positive, positive, positive","place, spots, staff, vacation"
89ba24b1d54a49608d57db9fbddc0dc8,2023-02-14 13:05:40,Taman Lembah DEWATA,Lumayanlah... Enak... Sejuk... Cuma kalo sewa sepeda gak bisa di tuker. Padahal rem nya gak jalan.,4,neutral,negative,positive,"It's okay... Delicious... Cool... It's just that if you rent a bike, you can't exchange it. Even though the brakes don't work.","food, maintenance, facility","positive, negative, negative","food, brakes, bike"
0721ec3940fe43e3a105d95fe84a27fc,2019-02-23 18:22:49,Terminal Wisata Grafika Cikole,"Nature, exotic, comfort...suasana alam konsep yg berbeda...melengkapi semua kebutuhan berlibur 😊 …",5,neutral,neutral,positive,"Nature, exotic, comfort... a different nature concept... fulfilling all holiday needs 😊","nature, comfort","positive, positive","Nature, comfort"
059a05db5dda4afbb81ad3ab73680c80,2020-02-15 13:04:07,Taman Lembah DEWATA,"Mendatang pasti bagus...
Sekarang belum lengkap, tidak sempurna sebagai tempat rekreasi, santai...",5,neutral,neutral,positive,"The future will surely be good...
Currently it is not complete, not perfect as a recreational, relaxing place...",place,negative,place
d1f772767cec4cf09a3503c2ca49a269,2019-02-15 13:29:50,Stone Garden,"Tempat nya cukup indah menyuguhkan pemandangan awan, pemandangan gunung, pemandangan batu²an dll..",5,neutral,neutral,positive,"The place is quite beautiful, offering views of clouds, mountains, rocks, etc.","place, view, nature","positive, positive, positive","place, views, mountains"
bbe1de87303247228f6c8359e2283125,2019-02-15 13:29:02,Stone Garden,Salah satu spot foto sunrise dan sunset yang cukup keren. Banyak sudut tinggal asah kreatifitas...,5,neutral,neutral,positive,"One of the pretty cool sunrise and sunset photo spots. Lots of angles, just hone your creativity...","photo, spot","positive, positive","photo, spots"
7f6b94f6b6f94ca8ad9d9785c04bd2a4,2022-11-23 18:22:46,Terminal Wisata Grafika Cikole,Makanan liwetnya maknyussssss.. makan di saung lesehan ditengah hutan dan pemandangan asri..mantap,5,neutral,positive,neutral,The liwet food is delicioussssss.. eating in a lesehan hut in the middle of the forest with a beautiful natural view.. awesome,"food, atmosphere, nature, view","positive, positive, positive, positive","food, forest, nature, view"
f66140547c6e4fa28492767cca7a90fd,2019-02-15 14:15:38,Bukit Senyum,"keren tempatnya .. Nyegerin pikiran .. Gak cuman ada Spot Pinus doang , tapi ada spot spot lainnya",3,neutral,neutral,positive,"Cool place. Refreshing for the mind. Not only is there a Pine Spot, but there are other spots too.","place, spot, spot","positive, positive, positive","place, Spot, spots"
f12b84fd92c346dbbba26a75bde08af6,2021-02-15 12:57:27,Kebun Begonia Lembang,Tempat cocok untuk rekreasi dengan pemandangan bunganya yg banyak sekali . Cocok membawa rombongan,5,neutral,neutral,positive,A suitable place for recreation with its abundant flower views. Suitable for bringing groups,"place, view","positive, positive","place, views"
1b5ff105d581453595533e719835da56,2019-02-15 13:29:45,Stone Garden,"View untuk foto bagus, cuman untuk mengambil foto memakai Dslr harus membayar dengan harga berbeda",5,neutral,negative,positive,"View for nice photos, but for taking photos with a DSLR you have to pay a different price.","view, photo, price","positive, positive, negative","View, photos, price"
b1fa02aa0e084d63beda8cf6247ef786,2022-02-15 13:28:48,Stone Garden,Keren hanya sejak pandemi jadi kaya kurang terawat. Daaannnn asap dari pabrik dibawah kurang enak.,4,neutral,negative,positive,"It's only been a mess since the pandemic, so it's become less maintained. And the smoke from the factory below isn't pleasant.","maintenance, air","negative, negative","maintained, smoke"
7742fb7d287944b885a40bf0b17c31fc,2020-02-15 13:29:03,Stone Garden,iya mohon mf atas kekurangan kami.oh ia kalo ada pungli selain karcis saya tekankan jangan dikasih,5,neutral,neutral,neutral,"Yes, we apologize for our shortcomings. Oh yes, if there is any illegal levy besides the ticket, I emphasize that you should not give it.",ticket,negative,ticket
db6e7ffe9696430f8d954b706f7c765a,2023-01-15 12:24:41,Curug Tilu Leuwi Opat,Curug nya tidak begitu banyak tapi worth to visit dicobain aja yaaa hehe tiket masuk lumayan mahal,3,neutral,negative,neutral,"The waterfalls aren't that many, but they are worth visiting. Just try them, hehe. The entrance ticket is quite expensive.","attraction, ticket","positive, negative","waterfalls, ticket"
64d52252ddfc447996feb305e67e74bf,2022-05-15 21:07:30,Curug Panganten,"Curugnya masih alami bgt,,alam yg masih terjaga,,cuman jln menuju lokasi masih baru jd harus hati""",5,neutral,neutral,positive,"The waterfall is still very natural, the nature is still preserved, only the road to the location is new so you have to be careful.","nature, road, location","positive, negative, neutral","nature, road, location"
73046f95683d4d42bcbe314030d7065a,2023-01-23 17:58:07,Floating Market Lembang,bisa makan ditengah tengah danau. ada pisang goreng yang enak. sambil menikmati dinginnya lembang.,5,neutral,neutral,neutral,can eat in the middle of the lake. there's delicious fried banana. while enjoying the coolness of Lembang.,"food, lake, atmosphere","positive, positive, positive","banana, lake, coolness"
f9cf63da7a644ae99849825ca9051823,2022-08-23 18:22:39,Terminal Wisata Grafika Cikole,"Tempat wisata yg cukup seru, ada Flying fox, climbing, jembatan tali dll, disini jg dapat camping.",4,neutral,neutral,positive,"A quite exciting tourist spot, with flying fox, climbing, rope bridge, etc., you can also camp here.","attraction, facility","positive, positive","spot, bridge"
e55146a1408b4694865bd405f43dc3b9,2021-02-15 13:23:31,Gunung Putri Lembang,"Tolong perbaiki air di toilet, jangan sampai bnyak yang arti berjam2, dan lokasi parkir di perluas",1,neutral,negative,neutral,"Please fix the toilet water, don't let people wait for hours, and expand the parking lot.","water, parking","negative, negative","toilet, parking"
9a9ee41a862c4383b9d6a81947340139,2019-02-23 18:23:00,Terminal Wisata Grafika Cikole,"Tempatnya keren, nyaman, sejuk, penginapan bersih, rapih, pelayanan baik..
Outbound nya juga seru..",5,neutral,positive,positive,"The place is cool, comfortable, and refreshing. The accommodation is clean and tidy, with good service. The outbound activities were also fun.","place, accommodation, service, activity","positive, positive, positive, positive","place, accommodation, service, activities"
8d955d90982e4928b5d9d13c5bf689bc,2020-02-15 13:48:43,Curug Maribaya,"Nyaman, tenang, sejuk, dekat dari bandung, tiket masuk juga tidak terlalu mahal...nyaman buat anak2",5,neutral,neutral,positive,"Comfortable, peaceful, cool, close to Bandung, the entrance ticket is not too expensive... comfortable for children.","comfort, peacefulness, ticket, accommodation","positive, positive, negative, positive","comfortable, peaceful, ticket, children"
1f53d1f4257342e28a52ea5816810ec5,2020-02-15 13:05:26,Taman Lembah DEWATA,"Semakin tertata dengan baik, tiket murah, cafe lumayan lengkap, ada sewa sepeda, perahu dan berkuda",5,neutral,positive,positive,"Increasingly well-organized, cheap tickets, a fairly complete cafe, bicycle, boat, and horseback riding rentals available.","ticket, cafe, facility, facility, facility","positive, positive, positive, positive, positive","tickets, cafe, bicycle, boat, horseback"
8c1bafc91240497490db99ca67464484,2021-02-15 13:43:53,Sanghyang Heuleut,"Akses jalan menuju spot sungguh luar biasa,siapkan energi ya klo mo kesini.
Spotnya exotic 👍🏻👍🏻👍🏻 …",4,neutral,neutral,positive,"The road access to the spot is truly amazing, prepare your energy if you want to come here. The spot is exotic 👍🏻👍🏻👍🏻","road, spot, spot","positive, positive, positive","road, spot, spot"
36ae3cfbbf2648eeb0830f03e34a3568,2019-02-15 13:24:37,Gunung Putri Lembang," Cuaca sejuk dengan suasana alam, worth untuk hiking seru bareng teman/keluarga, treknya friendly

",5,positive,neutral,positive,"Cool weather with a natural atmosphere, worth it for a fun hike with friends/family, the trek is friendly","weather, atmosphere, trail","positive, positive, positive","weather, atmosphere, trek"
19d7a43c54184157869da39699c3ac4e,2022-06-23 18:04:29,Gunung Tangkuban Parahu,"Tidak pernah bosan kesini...
Apalagi bisa bawa teman luar Jawa bisa berkunjung kesini.. menakjubkan",5,neutral,neutral,neutral,Never bored coming here... Especially when I can bring friends from outside Java to visit here.. amazing,"place, place","positive, positive","here, here"
773112bf4f2b41a081f4b2b72d168d37,2019-02-15 13:23:34,Gunung Putri Lembang,Kalo kesini usahakan membawa action cam karena cocok untuk berfoto dengan suasana alam yang santai.,5,neutral,neutral,positive,"If you come here, try to bring an action camera as it's suitable for taking photos in a relaxed natural setting.","photo, nature","positive, positive","photos, natural"
2491c5059b404dcaa88d2192a7842314,2022-10-23 18:04:08,Gunung Tangkuban Parahu,Pesona alam yang luar biasa yang diciptakan Allah SWT untuk kita nikmati bersama keluarga tercinta.,5,neutral,neutral,positive,The extraordinary natural charm created by Allah SWT for us to enjoy with our beloved family.,"nature, beauty","positive, positive","natural, charm"
f895ae5765844d4eacfa7dd1fa4d4199,2019-02-15 13:49:19,Curug Maribaya,Dengan Alam sejuknya yang tidak didapat dikota besar ...cuma jalurnya yang macet di waktu wekend...,5,negative,neutral,neutral,"With its cool nature, not found in big cities... only the roads get jammed on weekends...","nature, road","positive, negative","nature, roads"
be807f8a68c84f55b276b70dab350418,2023-01-18 12:39:21,Sarae Hills,"Cakep2 spot fotonya
Ada team yg bantu kita fotoin juga
Ada live music hall d tengah2
Recomended 👍 …",4,neutral,positive,positive,"Great photo spot
There's also a team that helps us take photos
There's a live music hall in the middle
Recommended 👍","photo, staff, music","positive, positive, positive","spot, team, music"
e3a1972720114dbdaf07393b481a0a55,2022-10-15 14:09:05,Curug Cimahi / Curug Pelangi,"Pokonya pengen lama-lama kalau udh di depan mata, males pulang karena tangganya itu loh. MasyaAllah",4,neutral,neutral,neutral,"I just want to stay longer when it's right in front of me, I don't want to go home because of the stairs, Mashallah.",accessibility,positive,longer
9993ae2f47524321a88af4010db4fb45,2022-02-23 18:04:30,Gunung Tangkuban Parahu,"Di luar ekspetasi dari tempat biasa aja sampai harga HTM, dobel parkir, jajanan dan sovenir wowwww.",3,neutral,negative,negative,"Beyond expectations, from the ordinary place to the entrance fee, double parking, snacks, and souvenirs, wowwww.","place, entrance, parking, food, souvenir","positive, negative, negative, positive, positive","place, entrance, parking, snacks, souvenirs"
e9ca5793941544f992b88a917edd828f,2022-02-15 12:24:56,Curug Tilu Leuwi Opat,"Udara sangat sejuk dan alami, perlu perawatan extra agar lebih baik lg, sehingga menarik pengunjung",5,neutral,neutral,positive,"The air is very cool and natural, it needs extra care to be even better, so as to attract visitors","air, maintenance","positive, neutral","air, care"
fcf3dfe67f294cbbae01d033b9913352,2022-04-15 14:09:02,Curug Cimahi / Curug Pelangi,Untuk turunnya lumayan gampang tapi ya capek haha sayang nya belum dapet momen yang ada pelangi nya,5,neutral,neutral,neutral,"Going down is quite easy, but it's tiring haha, it's a shame I haven't had a moment with a rainbow yet","walking, weather","negative, negative","going down, rainbow"
6b28a01587374520a60f70d847460bfd,2021-02-15 13:24:43,Gunung Putri Lembang,"
Tempat sunrise di Lembang yang cukup bagus. Mulailah dari subuh untuk melihat pemandangan terbaik.",5,neutral,neutral,positive,A pretty good sunrise spot in Lembang. Start from dawn to see the best view.,"spot, view","positive, neutral","spot, sunrise"
