id,datetime,location,text,rating,accessibility,facility,activity,english_translation,aspects,sentiment,real_aspect
40a6aba9edf14ad2b88f2c93595b0fa2,2022-02-15 13:22:56,Gunung Putri Lembang,Cakep pokok nya. Tapi jangan lupa bawa turun lagi sampah kalian ya biar gk penuh sama sampah,5,neutral,neutral,neutral,Awesome! But don't forget to bring your trash down with you so it doesn't get full of garbage.,cleanliness,negative,garbage
299b106077f4485397dd6164a6e9e2b3,2022-02-23 18:05:16,Gunung Tangkuban Parahu,Tempat bersejarah negri Sunda. Yang terletak di antara Kota Bandung dan Pemandian Air Panas.,5,neutral,neutral,neutral,Historical places of the Sunda kingdom. Located between Bandung City and the Hot Springs.,"history, location","positive, neutral","places, Located"
3eeba3836e6444cc8dc55199af0e4b8b,2022-09-15 12:24:41,Curug Tilu Leuwi Opat,"Sangat luar biasa ini tempat, Asri, sejuk dan wah dah. Bersama istri tercinta jalan2 ke sini.",5,neutral,neutral,positive,"This place is truly amazing, beautiful, cool, and wow. Went for a stroll here with my beloved wife.",place,positive,place
f5917d68ae9c45afba66977a6a40cfae,2021-02-15 13:04:38,Taman Lembah DEWATA,Taman yang indah bernuansa Bali dan lingkungannya bersih serta dalam perkembangan. Mantap !!!,5,neutral,neutral,positive,A beautiful Balinese-themed garden and its surroundings are clean and developing. Excellent!!!,"garden, cleanliness","positive, positive","garden, clean"
e018c511bd174fe695d06df96c6e6cc6,2022-02-15 14:05:07,Curug Layung Camp Situ Lembang,"Enak buat kemping ceria, tp jalan ke atasnya jelek, ga disaranin pake motor matic deh. Kasian",5,negative,neutral,positive,"Great for a fun camping trip, but the road up is bad, not recommended for automatic motorcycles. Poor things.","accommodation, road","positive, negative","camping, road"
13f3e635fc2b4197b7bc6d15de0a03f4,2022-06-23 17:57:18,Floating Market Lembang,"Lokasi outdoor dan cukup luas, cocok bwt melemaskan kaki,sambil menikmati udaranya yg sejuk..",4,neutral,positive,neutral,"Outdoor and spacious location, suitable for stretching your legs while enjoying the cool air.","location, air","positive, positive","location, air"
248f24750c024d5f83a0d0d75b39a266,2023-01-15 12:39:13,Sarae Hills,"Lumayan lah buat spot foto fotonya dan pegawainya ramah ramah ,bisa tolongin kita berfoto ria",4,neutral,positive,positive,"It's decent enough for photo spots, and the staff are friendly, they can help us take lots of photos.","photo, staff, photo","positive, positive, positive","photo, staff, photos"
aaac4fb0459a4a7e888331006dab25eb,2020-02-15 13:30:08,Stone Garden,"Wisata alam ,,cuma harus bawa pelindung terik matahari,,,,, ,,tapi indah nian,,bisa uji nyali",5,neutral,neutral,neutral,"Nature tourism, you just need to bring sun protection, but it's so beautiful, you can test your courage.","nature, beauty, attraction","neutral, positive, positive","Nature, beautiful, courage"
a560e0da5d8c42b1bdc890dbbc456df1,2023-01-15 12:57:29,Kebun Begonia Lembang,"Bersih dan bnyk bunga, tempat yg bagus untuk foto2. Ada sewa topi juga untuk masuk kebun ini.",5,neutral,neutral,positive,"Clean and lots of flowers, a good place for photos. There's also hat rental to enter this garden.","cleanliness, place, attraction, garden","positive, positive, positive, positive","Clean, place, garden, garden"
9574e1b94c6b454ebe210164ffb26e87,2019-02-15 13:29:57,Stone Garden,Tempat wisata asik murah meriah melihat keindahan alam yang luar biasa di Citatah Padalarang.,3,neutral,neutral,positive,Fun and affordable tourist spot to see the extraordinary natural beauty in Citatah Padalarang.,"spot, beauty, nature","positive, positive, positive","spot, beauty, nature"
8b66112b0ea84ba08af9869910b60f84,2022-11-15 14:13:22,Sanghyang Kenit,"
Ini seperti situs prasejarah. Tapi beberapa modernitas sudah hadir. Gradasi warnanya cantik.",5,neutral,neutral,neutral,This is like a prehistoric site. But some modernity is already here. The color gradation is beautiful.,"history, place","positive, neutral","site, here"
cd4cb50683df42b2bdf609cc4f62c865,2022-02-23 18:04:32,Gunung Tangkuban Parahu,"Pemandangan the best, cmn krn posisi di atas kerasa bnr klo pas panas tp jg sangat dingin....",5,neutral,neutral,positive,"The view is the best, but because the position is high up, it really feels hot when it's sunny, but also very cold...","view, location, weather","positive, negative, neutral","view, position, hot"
08805d1d44184246a48aa67b3d5ad6c9,2019-02-15 12:25:03,Curug Tilu Leuwi Opat,"Ok, tp sepanjang perjalanan banyak pipa yg menghalangi, ga diinjek susah, diinjek takut pecah",4,neutral,negative,positive,"Okay, but along the way there were many pipes blocking, it's hard to step on them, and I'm afraid they'll break if I do.","accessibility, maintenance","negative, negative","pipes, pipes"
135d0938ab354bb49b8bc1e113057659,2019-02-15 12:25:03,Curug Tilu Leuwi Opat,Worth it to try.. Ada jalur tracking yg beda.. Pemandangan oke bgt.. Harga tiket oke banget..,5,neutral,positive,positive,Worth it to try.. There's a different tracking path.. The view is really okay.. The ticket price is really okay..,"trail, view, price","positive, neutral, neutral","path, view, price"
7e42ea3e7d52409db04132ef816523e3,2019-02-23 18:04:46,Gunung Tangkuban Parahu,"Jalanan menuju kepuncak benar2 asri, hawanya sejuk bgt. Begitu smp atas bagus pemandangannya.",5,neutral,neutral,positive,"The road to the summit is truly beautiful, the air is very cool. Once you reach the top, the view is beautiful.","road, air, view","positive, positive, positive","road, air, view"
8ab70f4132af40ad9bddc03e73c85068,2019-02-15 13:29:48,Stone Garden,"Pemandangannya bagus tapi jalan lintas buat kesana tidak mendukung,masih berbatuan tapi bagus",3,negative,neutral,positive,"The view is good but the road to get there is not supportive, it's still rocky but good","view, road","positive, negative","view, road"
33e193fa52714668bdb0a472f2b96b63,2022-02-15 12:39:19,Sarae Hills,"Tempat nya sangat luas
Banyak spot poto
Perlu waktu yg lama untuk menjelajahi semua spot poto",4,neutral,neutral,positive,"The place is very spacious
Many photo spots
It takes a long time to explore all the photo spots","spaciousness, photo, photo","positive, positive, neutral","spacious, photo, spots"
79371e967abd4581aefcfc025e5a74dc,2019-02-15 13:23:07,Gunung Putri Lembang,"Tempat Yang nyaman untuk berlibur Dan mudah dijangkau, namun sangat minim transportasi publik",4,negative,neutral,positive,"A comfortable place to vacation and easy to reach, but with very minimal public transportation.","place, transportation, accessibility","positive, negative, positive","place, transportation, reach"
0aeecca8375846ca9e464552c4e229a6,2020-02-15 12:25:31,Curug Tilu Leuwi Opat,"
Tempat yang baik untuk berjalan atau mendaki, jalan menuju ke sana adalah di samping sungai.",5,neutral,neutral,positive,"A good place to walk or hike, the road to get there is beside the river.","place, road, river","positive, positive, neutral","place, road, river"
75653a83be46403e813754190c772278,2022-02-15 14:18:31,Curug Sawer Cililin,"Indah banget!!!!, udara nya bersih, terus ada beberapa permainan,seperti memanah,menembak dll",5,neutral,neutral,positive,"So beautiful!!!!, the air is clean, and there are several games, like archery, shooting, etc.","beauty, air, activity","positive, positive, positive","beautiful, air, games"
877aa4c3f0e248f9b7070f3a41be5215,2019-02-15 14:18:33,Curug Sawer Cililin,Tempatnya nyaman dan asri... Aplg ada sungai kecilnya itu lho... Nyaman wat bermain air anak2,3,neutral,neutral,positive,The place is comfortable and beautiful... Especially with that small river... Comfortable for kids to play in the water,"place, river, water, comfort","positive, positive, positive, positive","place, river, water, comfort"
29e0c4ce0e8d485090cad41c469d1101,2021-02-15 13:43:55,Sanghyang Heuleut,"Alamnya cantik dan menantang, saran sih jangan kesini kalau musim hujan sungainya jadi coklat",5,neutral,neutral,positive,"The nature is beautiful and challenging, my advice is don't come here during the rainy season, the river turns brown","nature, weather, river","positive, negative, neutral","nature, rainy season, river"
185f6c47dbf14ad988b602ba7b361f3e,2022-02-15 14:15:36,Bukit Senyum,"Bagus tempatnya, cuman kalo lama2 ngebosenin ngga ada yg unik, dan akses jalannya masih jelek",5,negative,neutral,positive,"The place is good, but if you stay too long it gets boring because there's nothing unique, and the road access is still bad.","place, attraction, road","positive, negative, negative","place, unique, road"
1716f605f5d1407ba4fca42f024fb8ad,2019-02-15 13:04:42,Taman Lembah DEWATA,"Tempatnya bagus dan sejuk,tp sayang musholanya kecil banget...lumayan buat hiling2 mah.. hehe",4,neutral,negative,positive,"The place is nice and cool, but unfortunately the prayer room is very small... It's decent for a short getaway though.. hehe","place, restroom","positive, negative","place, prayer room"
39aede5ca33746dca41026c73e5a5cd5,2019-02-23 18:05:27,Gunung Tangkuban Parahu,"TWA Tangkuban perahu objek wisata nya
Bagus enak buat spot foto
Dingin
HTM nya 20.000 weekday",5,neutral,neutral,positive,"TWA Tangkuban perahu is a tourist attraction
Good and nice for photo spots
Cold
Entrance fee is 20,000 on weekdays","attraction, photo, atmosphere, ticket","positive, positive, neutral, neutral","attraction, photo, cold, fee"
c44a2b691e96446ca8ee6f005280fb8a,2022-06-23 17:58:44,Floating Market Lembang,Seru banget .. tukar koin secukupnya .. makanan murah harga mulai dr 10rb - 35rb.. enak2 lagi,5,neutral,neutral,positive,So much fun.. exchange enough coins.. cheap food prices starting from 10k - 35k.. and it's delicious too,"crowd, food, price","positive, positive, positive","fun, food, prices"
3486d1c4a0914faa8c830bad36a088ed,2022-09-15 13:04:08,Taman Lembah DEWATA,"Bersih, enak dan nyaman, pokoknya bikin betah. Disamping itu bisa sambil terapi pijat & bekam",5,neutral,neutral,positive,"Clean, delicious, and comfortable, it makes you want to stay. Besides that, you can also get massage therapy and cupping.","cleanliness, food, comfort, entertainment, activity","positive, positive, positive, positive, positive","Clean, delicious, comfortable, massage, cupping"
2622d8ae2447446db0662953c20bd9e0,2019-02-23 18:05:18,Gunung Tangkuban Parahu,"usahakan pakai jaket kalau kesini. dr pengalaman saya ndak pake jaket,pulangnya perut kembung",5,neutral,neutral,neutral,"Try to wear a jacket if you come here. From my experience, I didn't wear a jacket and I got a bloated stomach when I went home.",weather,negative,here
7a4f60fa2dfd412384a47d609d14c564,2020-02-23 18:04:48,Gunung Tangkuban Parahu,Tempat Wisata Alam yg indah buat dikunjungi bersama keluarga dan lahan parkir yang cukup luas,4,neutral,positive,positive,Beautiful natural tourist spot to visit with family and spacious parking lot,"spot, parking","positive, positive","spot, parking"
6669dfc2419a472e9d66b1421a381d89,2020-02-15 13:04:07,Taman Lembah DEWATA,Tempat yang asik buat bawa main anak dengan tempat yang luas nyaman dan masih seger udara nya,4,neutral,neutral,positive,"A fun place to bring children to play with a spacious, comfortable, and still fresh atmosphere.","place, spaciousness, comfort, atmosphere","positive, positive, positive, positive","place, spacious, comfortable, atmosphere"
e0fe0fd9fd3f4734991ecfcccf9cf083,2023-01-23 17:58:20,Floating Market Lembang,"Pesan perahu sampai di dibalap 5 kali group lain gk diangkut,,kl seperti ini pelanggan kecewa",4,neutral,neutral,neutral,"Boat messages arrived, raced 5 times, other groups not transported, if like this customers will be disappointed.","transportation, service","negative, negative","Boat, customers"
e526041347264d6ca13f99444b53a519,2022-02-15 14:15:37,Bukit Senyum,harga tiket terlalu mahal ..melihat pasilitas jalan dan kebersihan sangat mengecewakan.👎👎👎👎 …,5,negative,negative,neutral,The ticket price is too expensive.. seeing the road facilities and cleanliness is very disappointing. 👎👎👎👎 …,"price, road, cleanliness","negative, negative, negative","price, road, cleanliness"
2121a1e3a2f14192abd6134ce157c9a2,2022-02-15 14:05:02,Curug Layung Camp Situ Lembang,Air terjun yg SyeugeuuRrrr dan pemandangan Hutan pinus yg Amazing... enak banget buat kemping,5,neutral,neutral,positive,The waterfall that's so refreshing and the amazing pine forest view... perfect for camping.,"attraction, view, facility","positive, positive, positive","waterfall, view, camping"
c2a639c7bb7d4c0bb06e2cf5a14d26ca,2022-08-23 18:34:20,Orchid Forest Cikole,"Pengalaman yg sangat menyenangkan di Orchid forest, liburan seru dengan keluarga di hari raya",5,neutral,neutral,positive,"A very pleasant experience at Orchid Forest, a fun holiday with family on the holiday.","place, place","positive, positive","Orchid Forest, holiday"
8a29c82ba1a24486883e521a0bec17d6,2021-02-23 18:05:21,Gunung Tangkuban Parahu,Tempatnya keren dan memang bagus banget untuk jalan-jalan bareng keluarga atau orang tercinta,5,neutral,neutral,neutral,The place is cool and really great for a stroll with family or loved ones,"place, walking","positive, positive","place, stroll"
be906bd69dc94e569d599dee2cc4296c,2020-02-23 18:23:16,Terminal Wisata Grafika Cikole,"Adem, bersih, banyak spot foto keren, tp sayang kesini cuma sebentar jd blm keliling semua...",5,neutral,positive,positive,"Clean, many cool photo spots, but unfortunately only came here for a short while so didn't get to explore everything...","cleanliness, photo, place","positive, positive, neutral","Clean, photo, here"
2755bbc3c4704f138eb70278967863f5,2022-02-23 18:23:16,Terminal Wisata Grafika Cikole,"Kalau perjalanan jauh lewati ini tempat rekomendasi banget buat istirhat,sambil ngopi,ngemil.",3,neutral,neutral,neutral,"If you're on a long trip, this place is highly recommended for resting, having coffee, and snacking.","place, accommodation, food","positive, positive, positive","place, resting, snacking"
e9a1328ab1bc4fc084a2ade756b347e6,2019-02-15 13:29:07,Stone Garden,Pemandangannya luar biasa... Kaya di luar negeri.. Pokonya the best deh. Gak bakalan nyesel..,5,neutral,neutral,positive,The view is amazing... Like overseas.. Simply the best. You won't regret it..,view,positive,view
372c3a9aab8441ec94ff3099c5b5026e,2022-12-23 18:23:23,Terminal Wisata Grafika Cikole,INDAH DAN ASRI PANORAMA HUTAN PINUS NYA DAN SERU2AN PERMAINAN NYA PLAYINGFORK DAN LAIN2 TOPLAH,5,neutral,neutral,positive,BEAUTIFUL AND LUSH ARE THE PINE FOREST VIEWS AND THE EXCITING GAMES LIKE PLAYING FORK AND OTHERS. TOP-NOTCH!,"view, entertainment","positive, positive","views, games"
8ea19703146b49998404f748b0fbad7a,2022-02-15 11:58:46,Curug Malela,"Curuknya sih bagus, cuma sayang trek dari parkiran ke curuknya masih jelek, jalan tanah merah.",4,negative,neutral,positive,"The waterfall is good, it's just a shame the path from the parking lot to the waterfall is still bad, a red dirt road.","water, trail, parking, road","positive, negative, positive, negative","waterfall, path, parking, road"
f4d114cb096548b083f5885238309e4f,2019-02-15 13:49:15,Curug Maribaya,Infrastruktur nya baik tempat nya juga nyaman bagus buat netijen yg hobi foto dengan view alam,4,neutral,positive,positive,"The infrastructure is good, the place is also comfortable and great for netizens who like to take photos with natural views.","place, photo, view","positive, positive, positive","infrastructure, place, photos"
5e6d9df490d64920bc862e55989cc209,2021-02-15 13:29:51,Stone Garden,"Update harga masuk
lintas lingkungan : 5000/motor
Tiket masuk : 8000/orang
Parkir : 5000/motor",5,neutral,neutral,neutral,"Entrance fee update
Cross-environment: 5000/motorcycle
Entrance ticket: 8000/person
Parking: 5000/motorcycle","price, price, parking","neutral, neutral, neutral","fee, ticket, Parking"
4eee2923c7c640ee89f546dbc5d0a123,2020-02-15 13:05:37,Taman Lembah DEWATA,"Arena bermain luas, ada danau bisa sewa perahu. Ada penyewaan 🏇, sepeda, beca, cukup lengkap …",4,neutral,positive,neutral,"Spacious play area, there's a lake where you can rent boats. There are rentals for 🏇, bicycles, pedicabs, quite complete...","spaciousness, lake, facility","positive, positive, positive","play area, lake, rentals"
f22081210ead463a8a758cd59c5b1ac8,2021-02-23 18:23:02,Terminal Wisata Grafika Cikole,Indah dan adem sejuk tempatnya. Pengen nanti kembali main k sana lagi dan nginap di villa nya.,5,neutral,neutral,positive,Beautiful and cool and pleasant the place is. Want to go play there again later and stay in the villa.,"place, accommodation","positive, positive","place, villa"
541422c56eb541179d5c45fa89c9676b,2022-11-23 18:22:00,Terminal Wisata Grafika Cikole,Sejuk asri pemandangan nya pas sama lokasi penginapan nya...dan pegawai nya sangat membantu...,5,neutral,positive,positive,"Cool, beautiful scenery, perfectly matches the accommodation location... and the staff are very helpful...","scenery, accommodation, location, staff","positive, positive, positive, positive","scenery, accommodation, location, staff"
364172fc21dd492585bc9bd801fe2b30,2019-02-15 13:29:52,Stone Garden,Tempat yang harus dilestarikan keberadaannya. Menjadi sumber ekonomi baru bagi warga sekitar .,5,neutral,neutral,neutral,A place that must be preserved. To become a new economic source for the surrounding community.,"place, place","positive, positive","place, place"
fa295f49d27d46deb9941901140783f8,2020-02-15 13:29:57,Stone Garden,"Tempat nya bagus, banyak peninggalan sejarah ditempat ini, tempat nya unik, instagramer banget",2,neutral,neutral,positive,"The place is good, there are many historical relics here, the place is unique, very Instagrammable","place, history, place, photo","positive, positive, positive, positive","place, relics, place, Instagrammable"
abd75d6225f647059f9216d5f22116ba,2022-07-15 14:09:08,Curug Cimahi / Curug Pelangi,"Sambil menikmati indahnya curug, bisa melihat perilaku kera yg banyak di sekitaran area wisata",3,neutral,neutral,positive,"While enjoying the beauty of the waterfall, you can see the behavior of the many monkeys around the tourist area.","beauty, nature, crowd","positive, positive, neutral","beauty, waterfall, monkeys"
46b776e202dd41cb964e9a31b748f2f6,2020-02-15 13:29:47,Stone Garden,Tempat yang nyaman  dan indah hanya saja akses jalan nya harus diperbaiki  banyak kera seru wk,4,negative,neutral,positive,"A comfortable and beautiful place, only the road access needs to be improved, many monkeys are fun lol","place, road","positive, negative","place, road"
cb689e26387c41479069749e251b0620,2022-06-15 13:04:26,Taman Lembah DEWATA,"Banyak spot foto yang bagus,tempatnya juga mudah buat di temukan soalnya ada dipinggir jalan..",5,positive,neutral,positive,"There are many good photo spots, and the place is easy to find because it's by the roadside.","photo, spot, place, road","positive, positive, positive, neutral","photo, spots, place, roadside"
8b4258a81bae429ca7d2af667cba51de,2022-05-15 14:09:24,Curug Cimahi / Curug Pelangi,"Masukannya,,bikin spanduk foto keindahan curugnya biar orang2 pada tahu keindahan dibawahnya,,",5,neutral,neutral,neutral,Suggestions: Make a banner with photos of the waterfall's beauty so people know about the beauty below it.,"photo, beauty, beauty","neutral, positive, positive","photos, beauty, beauty"
dc11dde3a9c44dd6a33ab4b3c1bc7e78,2020-02-15 13:28:52,Stone Garden,"Kalo jawa tengah punya Candi Borobudur
Kalo jawa Barat punya STONE GARDEN
Pokonya mantuuul deh",5,neutral,neutral,positive,"If Central Java has Borobudur Temple
If West Java has STONE GARDEN
It's really awesome","attraction, attraction","positive, positive","Temple, STONE GARDEN"
0bf8f1c2163d4e33b573b000f43d4c52,2022-02-15 12:39:32,Sarae Hills,"Tiket lumayan murah, parkir mobil juga bnyk. Tempatnya lumayan gak jauh beda dgn eha gn Kidul.",2,neutral,positive,positive,"The ticket is quite cheap, and there's a lot of car parking. The place is not much different from Eha Garden Kidul.","ticket, parking, place","positive, positive, neutral","ticket, parking, place"
236ebbf0488e4f21bd5509be2fd0bfb0,2022-09-15 13:05:00,Taman Lembah DEWATA,"Tempatnya asik untu berwisata
Bagus untuk tempat prewedding atau hanya sekedar berfoto selfi .",5,neutral,neutral,positive,"The place is great for traveling.
Good for prewedding photos or just for taking selfies.","place, photo","positive, positive","place, photos"
7ff06fce623d48a5b2597075d8039895,2022-06-15 13:23:03,Gunung Putri Lembang,"Rame yg camp, termasuk murah ya ngcamp htm 22k/org parkir 10k, klo ga ngcamp 10k/org parkir 5k",5,neutral,neutral,neutral,"The camping price is quite cheap, yes, camping is 22k/person for the entrance fee and 10k for parking. If not camping, it's 10k/person for the entrance fee and 5k for parking.","price, price, entrance, parking, entrance, parking","positive, positive, neutral, neutral, neutral, neutral","price, camping, entrance, parking, entrance, parking"
e2b1290852544a94abc12a1a648a98d7,2021-02-23 18:05:26,Gunung Tangkuban Parahu,"Bagus banget apa lagi yg di hutannya , cuma sayang jalannya hrs di perbaiki lagi biar ga rusak",4,negative,neutral,neutral,"It's really good, especially what's in the forest, it's just a shame the road needs to be repaired again so it doesn't get damaged.","nature, road","positive, negative","forest, road"
eabf83c3969745bf90d48e99a25c5ec5,2020-02-15 13:04:50,Taman Lembah DEWATA,"Enak bgt, bersih. Sama protokol kesehatan sangat mematuhi. Dan juga sangat di rekomendasi kan.",4,neutral,positive,positive,"Delicious, clean. Also very compliant with health protocols. And also highly recommended.","food, cleanliness, safety","positive, positive, positive","Delicious, clean, protocols"
2155ab8ee77c45df9d1f808b5fa1f30c,2021-02-23 18:34:57,Orchid Forest Cikole,"Tempatnya bagus, masih asri. Cocok bagi orang yang pengen refreshing ke kawasan Atas (lembang)",5,neutral,neutral,positive,The place is nice and still natural. Suitable for those who want to refresh in the highlands (Lembang).,"place, nature","positive, positive","place, natural"
385d8cf169eb46f8ae4d048a4b308890,2019-02-15 13:49:03,Curug Maribaya,"Lumayan ada kolam renangnya, ada tempat permainan anak, hanya saja air terjun alamnya kotor...",4,neutral,negative,neutral,"It has a decent swimming pool, a children's play area, but the natural waterfall is dirty...","facility, facility, attraction","positive, positive, negative","pool, area, waterfall"
ac2b032440f24e54b617cb4bae974a2c,2021-02-15 12:24:48,Curug Tilu Leuwi Opat,"Tempat yg seru buat petualang yg suka dengan alam , ada beberapa lokasi bagus buat di kunjungi",5,neutral,positive,positive,"A fun place for adventurers who love nature, with several good locations to visit.","place, nature, location","positive, positive, positive","place, nature, locations"
403852510f454430ad1cbeb2766e9bda,2021-02-15 12:24:48,Curug Tilu Leuwi Opat,Ini tempat asri banget sangat worth it untuk di kunjungi cuz pay 10K we can see many waterfall,5,neutral,neutral,positive,"This place is very beautiful, really worth visiting because for 10K you can see many waterfalls.","place, price, attraction","positive, positive, positive","place, 10K, waterfalls"
29137378182a46c68bab658d3c66bdd0,2022-02-23 18:22:28,Terminal Wisata Grafika Cikole,"Pengunjung bisa perorangan atau kelompok, pelayanan dari kru2nya memuaskan. Tidak membosankan.",5,neutral,positive,neutral,Visitors can come individually or in groups; the service from the crew is satisfying. It's not boring.,service,positive,service
d1b1d40e902a429a9dacd48df09ebe62,2019-02-15 13:43:42,Sanghyang Heuleut,"Setelah menempuh perjalanan yg jauh ,turun naik perbukitan akhirnya sampai juga,walaupun lelah",5,neutral,neutral,neutral,"After a long journey, going up and down hills, we finally arrived, even though we were tired",road,neutral,journey
4adc066661684ec9bffb636af982a35d,2021-02-15 14:13:13,Sanghyang Kenit,"Tempat yang bagus buat liburan plus tempatnya juga bagus buat spot poto yang instagramable :"")",4,neutral,neutral,positive,"A great place for a vacation, plus the place is also good for an Instagrammable photo spot :"")","place, place, photo, spot","positive, positive, positive, positive","place, place, photo, spot"
e4ddf57d65d44425818e11d448521bcc,2022-06-15 13:22:52,Gunung Putri Lembang,tempat asik kalau mau kemping ceria. walau jalan menuju tempat kemping nya dasyat tp worth it.,4,negative,neutral,positive,"A great place if you want to have a fun camping trip. Even though the road to the campsite is terrible, it's worth it.","place, road","positive, negative","place, road"
4d0c9f319df1419689361138a6cd6c7d,2022-05-23 18:04:56,Gunung Tangkuban Parahu,"Indah pemandangan alam, rekreasi yg bagus, perlu ditingkatkan lagi keberhasilan dan ketertiban",4,neutral,neutral,positive,"Beautiful natural scenery, good recreation, needs further improvement in success and order","scenery, attraction, management","positive, positive, negative","scenery, recreation, order"
ba0488b7f4484b24a8183bf87eafa429,2022-07-15 13:22:53,Gunung Putri Lembang,"Tempat yang baik untuk merefresh diri, tempatnya tidak jauh dari kota Bandung dan kota Lembang",5,neutral,neutral,neutral,"A good place to refresh yourself, the place is not far from Bandung city and Lembang city","place, location","positive, neutral","place, place"
b918ef78a2b647398b35a6d3623f9e24,2023-01-23 18:22:02,Terminal Wisata Grafika Cikole,"Banyak permainan dan tempat wisata seru, udaranya sangat sejuk dan pemandangannya sangat indah",5,neutral,neutral,positive,"Lots of fun games and tourist attractions, the air is very cool and the scenery is very beautiful","attraction, air, scenery","positive, positive, positive","attractions, air, scenery"
