id,datetime,location,text,rating,accessibility,facility,activity,english_translation,aspects,sentiment,real_aspect
329035c589264b51b809d22c167d4c11,2022-02-23 17:57:22,Floating Market Lembang,"Taman'y bagus, saran ku kalo kesini jgn pas weekend / tgl merah. Karena utk menikmati taman di sini enak'y agak sepi pengunjung, kalo terlalu rame, sumpek & kurang menikmati utk foto².
Yg jual makanan banyak, sampe bingung mau jajan apa 😅",5,neutral,neutral,positive,"The park is nice, my suggestion is to not come here on weekends or public holidays. Because it's best to enjoy the park when it's less crowded, if it's too crowded, it's stuffy and less enjoyable for taking photos.
There are many food vendors, so many that you'll be confused about what to buy 😅","crowd, crowd, food, atmosphere","negative, negative, positive, negative","crowded, crowded, food, stuffy"
b740c0ca3a8a4545aa286f183c2b2953,2022-10-23 18:04:06,Gunung Tangkuban Parahu,"Kawah Ratu Tangkuban Parahu, tak hanya kaya akan keindahannya tetapi juga kaya akan mitos dan legenda nya. Lebih baik datang pagi hari saat sunrise buat dapat view yang indah, kalau siang hari akan panas sehingga sulit explore semua view.",5,neutral,neutral,positive,"Kawah Ratu Tangkuban Parahu is not only rich in beauty but also in myths and legends. It's better to come in the morning during sunrise for beautiful views, as it gets hot during the day, making it difficult to explore all the sights.",beauty,positive,beauty
82177250a5f541989e4f048292df60ec,2019-02-15 13:28:44,Stone Garden,"amazinggggggg!!!!! sukaaaa banget,,,batu nya eksotis lah,,,secara mereka bukan sembarang batu kan,,,kaya idup aja tuh batu,,,merka batu sejarah yg lamaaaaaa ketimbun  kena hujan panas ,,efek CO2 nya itu yg bikin mreeka gitu,,,aku suka!!!!",5,neutral,neutral,positive,"Amazinggggggg!!!!! I love it sooooo much,,, the stones are exotic,,, since they are not just any stones,,, the stones look alive,,, they are historical stones that have been buried for a looooong time exposed to rain and sun,,, the CO2 effect is what makes them like that,,, I love it!!!!","culture, history, nature, place","positive, positive, positive, positive","stones, stones, stones, it"
7afd6e8e795245b08a96f1ffb6759acf,2019-02-15 13:23:13,Gunung Putri Lembang,"Harga tiket masuk kalo buat maen doang cuma 7,5K tapi kalo ngecamp 17,5K. Parkirnya agak mahal 10K kalo buat camp. Jalan dari bawah/pos ke puncak atas itu sekitar 15menit.
Kalo udah di atas wagelaseh ada pohon pinus dan tugu atau monumen.",5,neutral,neutral,neutral,"The entrance fee for just playing is 7.5K, but for camping it's 17.5K. Parking is a bit expensive at 10K if you're camping. The walk from the bottom/post to the top peak takes about 15 minutes. Once you're at the top, wow, there are pine trees and a monument.","entrance, price, price, parking, walking, attraction, monument","neutral, neutral, neutral, neutral, neutral, positive, positive","entrance, fee, fee, parking, walk, monument, monument"
82bd5012ef8842de9d4ca87fb72e672a,2019-02-15 13:49:04,Curug Maribaya,Ini adalah tempat yang indah untuk menghabiskan waktu dan menikmati alam. Kamu dapat mencapai tempat ini menggunakan mobil langsung kesana atau via THR Juanda dimana kamu harus berjalan kaki terlebih dahulu dan menikmati lebih banyak spot,5,positive,neutral,positive,"This is a beautiful place to spend time and enjoy nature. You can reach this place by car directly, or via THR Juanda where you have to walk first and enjoy more spots.","place, nature, place, spot","positive, positive, positive, positive","place, nature, place, spots"
a4ab7b97b2f14d63b5491dd4729c14e5,2022-08-15 14:05:03,Curug Layung Camp Situ Lembang,"Tempatnya oke,
Tiket hanya 10K untuk hiking,20k untuk camping
Curugnya sendiri dr pintu masuk 15menit,
Area campingnya ada bbrpa lokasi.
Sayangnya aksesnya ke lokasi (dari dsn bambu ) sangat kurang bersahabat jalannya (rusaaaaak paraaaah)",3,negative,neutral,positive,"The place is okay.
Tickets are only 10K for hiking, 20K for camping.
The waterfall itself is 15 minutes from the entrance.
There are several locations for the camping area.
Unfortunately, the access to the location (from Dusun Bambu) is very unfriendly, the road is (terribly broken).","place, ticket, hiking, entrance, location, road","neutral, neutral, neutral, neutral, neutral, neutral","place, Tickets, hiking, camping, waterfall, entrance"
d3f2c1f661a84ab3b9c84541e527e5d7,2022-02-15 13:04:05,Taman Lembah DEWATA,"Tempatnya luas, keren, parkiran luas. Tapi sayang, Musholanya kecil dan kenapa Mushola menghadap toilet? Jadi kesannya kayak Musholanya di toilet. Semoga lekas diperbaiki, dan jika Mushola sudah diperbaiki, saya perbaiki pula rating saya.",4,neutral,negative,positive,"The place is spacious, cool, and has ample parking. But unfortunately, the prayer room is small, and why does the prayer room face the toilet? So it gives the impression that the prayer room is in the toilet. Hopefully, it will be fixed soon, and once the prayer room is fixed, I will improve my rating.","place, parking, restroom, restroom, management","positive, positive, negative, negative, positive","place, parking, prayer room, prayer room, fixed"
259652a364f94774b5cedc92d00e3348,2022-08-23 18:22:39,Terminal Wisata Grafika Cikole,"Untuk restoran standard service makan, rasanya hampir mirip dengan restoran transit atau resto tempat bus melakukan service makan. Untuk kamar mandi kurang banyak sehingga banyak antrian apabila ada banyak bus yang datang secara bersamaan",4,neutral,negative,neutral,"For a standard service restaurant, the taste is almost similar to a transit restaurant or a restaurant where buses stop for meals. For the restrooms, there aren't enough, leading to long queues when many buses arrive simultaneously.","service, food, restroom, crowd","neutral, negative, negative, negative","service, taste, restrooms, buses"
0ddca1656dcb4236989be6e472389942,2022-08-23 18:04:02,Gunung Tangkuban Parahu,"Dr parkiran ke atas harus naik kemdaraan seperti elf tp terbuka, stlh itu baru sampai kawasan kawah Ratu. Udara di sana lumayan dingin. Panas pas terik. Dateng pas hari libur kemaren jadi rame banget. Toilet dan jajanan jg banyak di sini.",5,positive,positive,neutral,"The parking lot upstairs requires riding an open-air vehicle like an elf, after which you will reach the Ratu Crater area. The air there is quite cold. Hot when it's sunny. It was very crowded because we came on a holiday. There are also many toilets and snacks here.","parking, air, weather, crowd, restroom, food","neutral, neutral, neutral, negative, positive, positive","parking, air, sunny, crowded, toilets, snacks"
54bc251ba4444f08bf1b3c2918b68fc6,2019-02-15 12:57:10,Kebun Begonia Lembang,"Tempatnya tidak terlalu luas, cocok buat temen-temen yang suka selfie dan swafoto. Jual bibit tanaman juga, tapi kalau mau yang murah di pinggirnya ada yang jualan bunga. Harga tiket 10k aja per orang. Kalau bawa kamera, harus bayar lagi.",5,neutral,neutral,positive,"The place isn't too spacious, perfect for friends who like to take selfies and group photos. They also sell plant seedlings, but if you want something cheap, there are flower sellers on the outskirts. The ticket price is only 10k per person. If you bring a camera, you have to pay extra.","spaciousness, photo, souvenir, price, ticket","negative, positive, positive, positive, neutral","spacious, photos, seedlings, price, ticket"
a3cc5a6b3da547f68ff4c5f0d6516c26,2022-02-15 13:04:45,Taman Lembah DEWATA,"Harganya terlalu mahal sedangkan wahana nya bayar semua dan mahal, dan kulinernya TDK lengkap, cuma ayam Krispy +nasi+teh tawar seharga 28 ribu, sedang kan biaya masuk 20k per orang , parkir motor 5k, pantesan sepi .TDK sesuai expektasi..",5,neutral,negative,negative,"The price is too expensive, while all the rides are paid and expensive, and the culinary options are not complete, just crispy chicken + rice + plain tea for 28 thousand, while the entrance fee is 20k per person, motorcycle parking is 5k, no wonder it's empty. It did not meet expectations.","price, price, food, price, ticket, parking, crowd","negative, negative, negative, negative, negative, negative, negative","price, rides, culinary, tea, entrance, parking, empty"
53da29925f3745708c2986b222b5c655,2022-04-15 14:13:02,Sanghyang Kenit,Tempatnya amazing banget..masyaalloh segala puji bagi Alloh..maha pencipta keindahan yg sempurna..tiket masuk dan parkir terjangkau.senang main air tapi banyak binatang kecil ky lintah nempel2 di kaki dan tangan.bagus buat foto2 aja ya...,5,neutral,positive,positive,"The place is amazing... all praise be to Allah... the perfect creator of beauty... entrance ticket and parking are affordable. It's fun to play in the water, but there are many small creatures like leeches sticking to your legs and hands. It's good for taking pictures.","place, beauty, ticket, parking, water, photo","positive, positive, positive, positive, negative, positive","place, beauty, ticket, parking, water, pictures"
1686deddcd2b4641bc30956c574ae087,2021-02-15 13:43:37,Sanghyang Heuleut,"Akses jalan ke sana aman buat kendaraan biasa. Parkirnya luas banget. Trekkingnya seru, variatif, ada batuan serta pepohonan. Banyak yang jualan makanan. Seru bisa renang dan terjun dari batuan, dari yang pendek sampai yang tinggi banget.",5,positive,neutral,positive,"The road access there is safe for regular vehicles. The parking is very spacious. The trekking is exciting and varied, with rocks and trees. Lots of food vendors. It's fun to swim and jump from the rocks, from short ones to very high ones.","road, parking, trail, food, activity","positive, positive, positive, positive, positive","road, parking, trekking, food, swim"
7ea33444b6924a38aab806844c418d2f,2019-02-23 18:23:11,Terminal Wisata Grafika Cikole,"Tempatnya bagus , asri karena banyak pohon di sini. Petugas ramah. Tempat parkir banyak sampah berserakan. Tapi di dalamnya bersih. Saya mencoba flying fox dan suka sekali. Tidak terlalu tinggi. Aman Alhamdulillah 😁. Ingin ke sana lagi. …",4,neutral,negative,positive,"The place is nice, green with many trees here. The staff are friendly. The parking lot has a lot of scattered trash. But inside it's clean. I tried the flying fox and loved it. Not too high. Safe, thank God 😁. Want to go there again. …","place, staff, parking, cleanliness, activity, safety","positive, positive, negative, positive, positive, positive","place, staff, parking, inside, flying fox, Safe"
7cfba6d0b9f84a59b58ae31c54db4ef1,2020-02-15 13:48:51,Curug Maribaya,"Bagus sekali untuk berakhir pekan disini, tempat nyaman, sangat mudah untuk solat disini karena mushola dan kamar mandinya sangat bersih.

Kita tidak boleh membawa stroller masuk kedalam karena hampir lebih dari 50% jalanannya bertangga..",5,neutral,neutral,positive,"Excellent for a weekend getaway, a comfortable place, very easy to pray here because the prayer room and bathrooms are very clean.

We are not allowed to bring strollers inside because more than 50% of the pathways are stairs.","accommodation, place, restroom, cleanliness, walking, accessibility","positive, positive, positive, positive, negative, negative","getaway, place, prayer room, bathrooms, pathways, stairs"
e60e4c13707d480aa22fbde9ce128f70,2019-02-15 13:24:44,Gunung Putri Lembang,"
Ini adalah tempat yang sangat bagus untuk aktivitas luar ruangan seperti hiking. Tapi saya tidak merekomendasikan jika Anda ingin berkemah untuk malam di gunung ini karena toilet sangat jauh dari lokasi perkemahan dan tidak cukup bersih.",5,neutral,negative,positive,This is a great place for outdoor activities like hiking. But I don't recommend it if you want to camp overnight on this mountain because the toilets are very far from the campsite and not clean enough.,"place, activity, mountain, restroom, cleanliness","positive, positive, negative, negative, negative","place, hiking, mountain, toilets, clean"
a0f75b9efc69402a8d4cc5b89668e7a7,2020-02-15 21:07:30,Curug Panganten,Pemandangannya sangant bagus meski perjuangan untuk sampai ke tempat sangat berat karena akses jalan setapak dan naik turun tapi setelah sampai lokasi terbayar sudah rasa lelah dengan air yg sangan segar dan ada wangi kayu cendananya.....,5,negative,neutral,positive,"The view is very beautiful even though the journey to get there was very tough due to the trail access and the ups and downs, but once you reach the location, the fatigue is paid off with the very fresh water and the scent of sandalwood.","view, trail, location, water, nature","positive, negative, positive, positive, positive","view, trail, location, water, scent"
4fb6533544904f2abeb58763be77fbda,2023-01-15 14:20:46,Situ Ciburuy,"Sebuah situ iconik di bandung barat, sampai dibuatkan sebuah lagu yg sangat terkenal. Lokasinya strategis dipinggir jalan utama bandung jakarta. Hanya saja promosi wisata dan event yg kurang jd blm menjadi tempat destinasi wisata populer.",3,positive,negative,neutral,"An iconic place in West Bandung, so famous it even has a song made about it. The location is strategic, on the side of the main Bandung-Jakarta road. It's just that tourism promotion and events are lacking, so it hasn't become a popular tourist destination.","place, location, road","positive, positive, positive","place, location, road"
9a26fa0aa4a24a26b0ca55466562c9e8,2020-02-15 13:48:54,Curug Maribaya,"Di Maribaya ada beberapa lokasi menarik yang dapat Anda kunjungi, salah satunya Air Terjun Maribaya. Air terjun ini adalah air terjun yang masih sangat alami dengan latar pepohonan yang akan membuat Anda merasa tenang bila berada di sini.",5,neutral,neutral,positive,"In Maribaya, there are several interesting places you can visit, one of which is Maribaya Waterfall. This waterfall is still very natural with a backdrop of trees that will make you feel calm when you are here.","place, nature, peacefulness","positive, positive, positive","places, natural, calm"
c26ac69c5b9748f898ccf96176ba1f56,2022-10-15 11:58:44,Curug Malela,"Sangat indah meskipun airnya keruh karena sedang musim hujan
Walaupun dengan perjuangan yang luar biasa, tapi hilang lelah begitu sampai lokasi
Cuma karena efek pandemi, jadi saung2 pada rusak, akses kurang terawat
Ayoo bangkit lagiii @KBB",5,positive,negative,positive,"Very beautiful even though the water is murky because it's the rainy season
Despite the extraordinary struggle, the fatigue disappeared upon arriving at the location
It's just because of the pandemic's effect, so the huts are all damaged and the access is poorly maintained
Let's rise again @KBB","beauty, water, location, facility, maintenance, road","positive, negative, positive, negative, negative, negative","beautiful, water, location, huts, maintained, access"
e1864660b28944f3a7c7b3e01300b97f,2022-08-23 18:33:59,Orchid Forest Cikole,Tempat wisata yg baik. Sejuk dan bersih. Sangat terlihat terawat. Tersedia banyak toilet dan di sediakan mobil untuk antar ke tempat parkir. Karna jalur wisata hanya satu arah. Tempat² foto begitu banyak. Dan tersedia untuk area anak-anak.,5,neutral,positive,positive,"A good tourist spot. Cool and clean. Very well maintained. Plenty of toilets available, and a car is provided to take you to the parking lot. Because the tourist route is one-way. Many photo spots. And there's an area for children.","spot, maintenance, restroom, parking, photo, entertainment, spaciousness","positive, positive, positive, positive, positive, positive, positive","spot, maintained, toilets, parking, photo, area, area"
55f02f51522040d5846fae5c43604ec6,2020-02-23 18:04:24,Gunung Tangkuban Parahu,"Tiket masuk 30k, dari Lembang dapat naik angkot yang berwarna kuning. Jika ke Tangkuban Parahu dapat disempatkan untuk mengunjungi pusat informasi untuk mengetahui sejarah Gunung Tangkuban Parahu. Jangan lupa mengenakan jaket karena dingin",5,neutral,positive,neutral,"Admission is 30k, you can take a yellow angkot from Lembang. If you're going to Tangkuban Perahu, make time to visit the information center to learn about the history of Mount Tangkuban Perahu. Don't forget to wear a jacket because it's cold.","price, transportation, information, history, weather","neutral, neutral, neutral, neutral, negative","Admission, angkot, information, history, cold"
c06dc97a7be243cab9f8a72d2577d813,2022-02-23 18:04:12,Gunung Tangkuban Parahu,"Tetap menakjubkan dan indah seperti yg saya ingat.... hanya saja sangat di sayangkan pengunjung kurang mengerti untuk menjaga lingkungan dengan tidak membuang sampah sembarangan
Berikut saya sertakan foto² keindahan gunung tangkuban perahu",5,neutral,negative,positive,"Still amazing and beautiful as I remember it.... it's just a shame that visitors don't understand how to take care of the environment by not littering.
Here I include photos of the beauty of Tangkuban Perahu mountain.","beauty, place, nature","positive, neutral, positive","beauty, Tangkuban Perahu, nature"
80293f78e30f4d5ebba6051c755b4b62,2020-02-15 13:28:39,Stone Garden,Wisata murah meriah didaerah Padalarang Bandung. Cuma ada baiknya kalian kesini pas hari cerah soalnya akses jalannya masih tanah. Kalo habis hujan rawan untuk pengendara terutama roda dua... Buat yg mau prawed rekomend banget seriusan 😂 …,4,neutral,positive,neutral,"Affordable and cheerful tourism in the Padalarang area of Bandung. It's just that it's better to come here on a sunny day because the road access is still unpaved. If it has rained, it's risky for riders, especially two-wheeled vehicles... For those who want pre-wedding photos, highly recommended, seriously 😂 …","price, place, road, photo","positive, positive, negative, positive","affordable, area, road, photos"
8365a35f30cf46f4bfadc0de9fd51601,2022-02-23 18:04:07,Gunung Tangkuban Parahu,"Sudah lebih bagus lagi, wisata alam yg menyejukkan mata. HTM di hari sabtu 30k per orang, parkir mobil 35k + 5k.
Bisa menikmati pemandangan dari berbagai sisi. Di gerbang masuk ada pemeriksaan suhu dan kartu vaksin. Tetap perhatikan prokes",5,neutral,positive,positive,"It's even better now, a refreshing natural attraction. Entrance fee on Saturdays is 30k per person, car parking is 35k + 5k.
You can enjoy the scenery from various angles. At the entrance, there's a temperature and vaccination card check. Please continue to observe health protocols.","attraction, price, parking, scenery, entrance, entrance, facility, facility","positive, neutral, neutral, positive, neutral, neutral, neutral, neutral","attraction, fee, parking, scenery, entrance, entrance, check, card"
da67f6cf43b24d03b59e76aec0396425,2020-02-15 13:23:14,Gunung Putri Lembang,Untuk tempat lumayan nyaman buat camping. Namun saran kepada pengelola fasilitas seperti Toilet/MCK agar ditambah lagi. Karena pengunjung banyak banget. Toilet hanya beberapa saja. Alhasil ngantri berjam². Semoga kedepannya lebih baik lagi,3,neutral,negative,positive,"For a place, it's quite comfortable for camping. However, a suggestion to the facility managers like the Toilets/Restrooms is to add more. Because there are so many visitors. There are only a few toilets. As a result, people queue for hours. Hopefully, it will be better in the future.","place, comfort, facility, restroom, crowd","positive, positive, negative, negative, positive","place, comfort, facility, toilets, visitors"
e4bef55dbe514c3b84d005610e47b065,2020-02-23 18:34:56,Orchid Forest Cikole,"Saat ini dibuka kembali, krna lagi covid dibrikan perhatian khusus bagi para pengunjung ,bnyk tempat untuk cuci tangan pemeriksaan suhu serta dapat free masker . Untuk tempatnya sangat luas dan bersih, fasilitas dan sport ftonya sngt bagus",4,neutral,positive,positive,"It is now reopened, and due to COVID, special attention is given to visitors. There are many places to wash hands, temperature checks, and free masks are provided. The place is very spacious and clean, with excellent facilities and photo spots.","facility, place, cleanliness, spaciousness, photo","positive, positive, positive, positive, positive","facilities, place, clean, spacious, photo"
a14bcc5028dd412ba6400718944de8a8,2022-05-15 12:24:42,Curug Tilu Leuwi Opat,"Tempat nya sangat indah & luas sehingga hampir di setiap area, dapat dijadikan spot photo yang cantik.
Semoga kesan alami nya dapat dijaga oleh pengelola tanpa menambah hiasan hiasan atau mainan anak anak berwarna warni dangdut nan norak!!",5,neutral,positive,positive,"The place is very beautiful & spacious, so almost every area can be a beautiful photo spot.
Hopefully the natural impression can be maintained by the management without adding gaudy, colorful decorations or children's toys.","place, spaciousness, photo, spot, nature, maintenance, management","positive, positive, positive, positive, positive, positive, positive","place, spacious, photo, spot, natural, maintained, management"
5cf83f88d05f40c89133f7f10f3916cd,2020-02-15 14:13:05,Sanghyang Kenit,"Sanghyang Kenit, tempat wisata Alan asri nan sejuk yg wajib sahabat pelesir kunjungi. Merupakan salah satu destinasi wisata yang berada di daerah Bandung barat.

Simak ulasan lengkapnya di wisatapelesir.com

""Sahabat Wisata & Pelesir Anda""",5,neutral,neutral,neutral,"Sanghyang Kenit, a beautiful and cool natural tourist spot that is a must-visit for friends traveling. It is one of the tourist destinations located in the West Bandung region.

Read the full review at wisatapelesir.com

""Your Travel & Tour Companion""","attraction, spot, location","positive, positive, positive","Sanghyang Kenit, spot, region"
18c1c5a543cb449892a929e800bbd8d7,2022-12-23 17:57:01,Floating Market Lembang,"Indah sekali, sejuk...bnyk tmpt spot poto, ada Prosotan Rainbow, prosotan bwt anakw jg ada, yg bikin hati deg2 an, klo blh saran tlg dong d sediakan semacam pengangkut org scra otomatis gtu jd pas naik k ats k wahana Rainbow gk ngos2 an gtu",5,neutral,neutral,positive,"So beautiful, cool... lots of photo spots, there's a Rainbow Slide, a slide for children too, which makes the heart beat faster. If I may suggest, please provide some kind of automatic transporter so that when going up to the Rainbow attraction, you don't get out of breath.","photo, attraction, facility","positive, positive, negative","spots, Rainbow, transporter"
3c5000eb77854095b9f9e2b4ddfbaf30,2020-02-15 13:04:13,Taman Lembah DEWATA,"Tempat wisata yang dapat menguras keringat. Cocok bagi yang senang berolahraga jalan kaki, bersepeda, berkuda dan mendayung perahu sembari menikmati pemandangan alam yang indah. Tersedia mushola, toilet, kantin, dan lapang parkir yang luas.",5,neutral,positive,positive,"A tourist spot that will make you sweat. Suitable for those who enjoy walking, cycling, horse riding, and rowing a boat while enjoying beautiful natural scenery. A prayer room, restrooms, a canteen, and a spacious parking lot are available.","spot, walking, nature, scenery, restroom, parking","positive, positive, positive, positive, neutral, neutral","spot, walking, nature, scenery, prayer, restrooms"
ad433fb0d4d84d8fb046722cdd94b805,2020-02-15 12:57:15,Kebun Begonia Lembang,"bagus sebenernya bunga2nya cuman terlalu banyak aksen kayak patung2, trus burung kertas yang di gantung gantung gitu membuat ke estetikan bunganya jadi hilang. Lebih ke kayak taman anak anak sih menurutku. Kalo buat wisata anak anak okelah.",5,neutral,neutral,negative,"Actually, the flowers are nice, but there are too many accents like statues, and the paper birds hanging around make the aesthetics of the flowers disappear. I think it's more like a children's garden. If it's for children's tourism, it's okay.","garden, atmosphere, place","negative, negative, neutral","garden, aesthetics, place"
47a913f42dcc4d8387bfe64c1a0c6a4b,2022-07-23 17:57:46,Floating Market Lembang,"Tempat wisata atau lebih tepat nya tempat jajan yang unik di Lembang, Karena semua pedagangnya berada di atas Perahu. Ada wahana sepeda air Dan perahu juga. Spot foto nya banyak, bisa sewa kostum ala Korea Dan jepang juga, pokoknya mantap..",5,neutral,neutral,neutral,"A tourist spot, or more precisely a food spot, that's unique in Lembang. Because all the vendors are on boats. There are also paddle boat and boat rides. There are many photo spots, and you can rent Korean and Japanese-style costumes too, it's just great.","spot, food, spot, facility, attraction, photo, souvenir","positive, positive, positive, positive, positive, positive, positive","spot, food, spot, boats, rides, photo, costumes"
419d931ec07e407cb57785759694d017,2020-02-23 18:34:53,Orchid Forest Cikole,"Tampatnya enak untuk menghilangkan penat, suasana sejuk dan banyak area bermain buat anak-anak cocok, ada adventure, mini golf, kelinci, flaying fox dan saat mau naik ke tempat parkir sudah ada angkutan yang siap membawa kita kembali gratis",5,neutral,positive,positive,"The place is nice for relieving fatigue, cool atmosphere and many playgrounds for children are suitable, there is adventure, mini golf, rabbits, flying fox and when going up to the parking lot there is already transportation ready to take us back for free.","place, atmosphere, parking, transportation","positive, positive, positive, positive","place, atmosphere, parking, transportation"
c0232107768b4de29bd346732e0b671e,2022-02-15 13:24:37,Gunung Putri Lembang,"
Hiking ringan yang bagus
Agak kotor karena banyak pengunjung tidak begitu peduli dengan lingkungan
Yang lebih buruk, banyak trek dalam kondisi buruk seperti menggunakan motor cross
Jejak sebenarnya bisa pergi ke tangkuban prahu ceater juga",5,negative,negative,positive,"Good light hike
A bit dirty due to many visitors not caring much about the environment
Worse, many trails are in bad condition, like being used by dirt bikes
The actual trail can also go to Tangkuban Prahu center","light, cleanliness, trail, trail, trail, attraction","positive, negative, negative, negative, negative, neutral","light, dirty, trail, trail, trail, Tangkuban Prahu"
