id,datetime,location,text,rating,accessibility,facility,activity,english_translation,aspects,sentiment,real_aspect
018ae7fd6fa847e89e227fe814b09b14,2020-02-23 18:34:59,Orchid Forest Cikole,"sukaa banget disini.. tempatnya tenang bgt, walau awalnya jalan menuju kesini ada yg rusak parah skitar 1km (yg bannya ceper lbh baik pikir 2x) tapi pas masuk worth it bgt.. dingin, pemandangan bagus dan pulangnya menuju parkiran bisa naik free shutle car jadi ga berasa capek..",4,neutral,positive,positive,"Love it here so much. The place is very peaceful. Even though initially the road leading here was badly damaged for about 1km (those with flat tires should think twice), once you arrive, it's totally worth it. It's cool, the view is good, and on the way back to the parking lot, you can take a free shuttle car, so you don't feel tired.","place, peacefulness, road, view, parking","positive, positive, negative, positive, positive","place, peaceful, road, view, parking"
8533b259bf384264b78b4ae2566f363d,2020-02-15 13:28:44,Stone Garden,"Recommend datang pagi, atau sore (jam 6 sudah buka, apalagi utk y g photo prewedding, harga 300K ada karcisnya).  Bawa air besih di Botol ya..  Toiletnya gak keurus  banget, jd kl gak kepaksa bgt lebih baik ke toilet di pom bensin atau warung makan..  Sembari makan siang/jajan.",4,neutral,negative,positive,"Recommend coming in the morning or afternoon (it opens at 6 AM, especially for those doing pre-wedding photos, the price is 300K and includes a ticket). Bring clean water in a bottle. The toilets are very neglected, so if you're not desperate, it's better to use the toilets at a gas station or a food stall while having lunch/snacking.","opening_hours, photo, price, ticket, water, restroom, maintenance","positive, positive, neutral, positive, positive, negative, negative","morning, photos, price, ticket, water, toilets, neglected"
9b1913bc4fcf4346b3ee9425e2bb19c2,2022-11-15 14:20:47,Situ Ciburuy,"Suasana asri, cocok ini untuk refreshing hanya saja jalur ke tempat ini merupakan jalur macet sehingga kadang belum sampai ke lokasi tujuan sudah bete duluan, tapi meskipun begitu suasananya sepadan lah dengan macet macetannya, buat yang tidak sabaran macet harap bersabar hehe…",5,neutral,neutral,positive,"The atmosphere is lush and beautiful, perfect for refreshing. The only downside is that the route to this place is prone to traffic jams, so sometimes you get frustrated before even reaching your destination. However, despite that, the atmosphere is worth the traffic jams. For those who are impatient with traffic, please be patient, hehe...","atmosphere, road, atmosphere","positive, negative, positive","atmosphere, route, atmosphere"
774ecfdb2ec0431faa96e6a6b5a42618,2019-02-15 14:15:31,Bukit Senyum,"Untuk pemerintah Jalan Lebih diperhatikan aset berharga. Kawasan tetap di Jaga kelestariannya kebersihan pengunjung ok fasilitas Kantin Toilet, tempat wudhu mushola ok spot Foto Lokasi kemah ok, lokasi wisat lebih ditingkatkan ditata lebih baik lagi Pengelola Ramah, Harga Siip.",4,negative,positive,positive,"For the government, the road should be given more attention as a valuable asset. The area should maintain its sustainability, cleanliness, and visitor facilities such as canteens, toilets, prayer rooms, and photo spots. Camping sites are okay, and tourist locations should be further improved and better organized. The management is friendly, and the prices are good.","road, cleanliness, facility, facility, facility, facility, facility, accommodation, management, price","neutral, positive, positive, positive, positive, positive, positive, positive, positive, positive","road, cleanliness, canteens, toilets, prayer rooms, photo spots, Camping sites, tourist locations, management, prices"
1f8e19677fe941679b5e99d10bfc1995,2021-02-23 18:04:16,Gunung Tangkuban Parahu,"Tempat nya deket The Orchid Forest Cikole sekitar 15 menitan ,HTM 54 ribu untuk 2 orang 1 motor ,Suhu nya sangat dingin dekat ke Kawah nya, Banyak penjual disekitar kawah yang siap membantu mengambil foto ,Banyak warung2 makan dan oleh-oleh ada penyewaan kuda ,Masjid juga ada ,",4,neutral,positive,neutral,"The place is near The Orchid Forest Cikole, about 15 minutes away. The entrance fee is 54 thousand for 2 people and 1 motorbike. The temperature is very cold, close to the crater. There are many vendors around the crater ready to help take photos. There are also many food stalls and souvenir shops, and horse rentals are available. There is also a mosque.","place, entrance, weather, crowd, photo, food, souvenir, accommodation","positive, neutral, negative, positive, positive, positive, positive, neutral","place, entrance, temperature, vendors, photos, food, souvenir, mosque"
5234c16ae0fe44ec8c0e0db3cc964eea,2021-02-15 13:28:37,Stone Garden,"Wisata batu di kabupaten bandung barat
Batuan alami sungguh menakjubkan
Tiket masuk rp 8.000
Tiket parkir rp 5.000
Akses masuk ke lokasi masih jalan berbatu namun tidak terlalu membuat kesulitan yang berlebihan
Banyak penjual jadi tidak usah khawatir dengan makanan atau minuman",5,negative,neutral,neutral,"Stone tourism in West Bandung Regency
Natural rocks are truly amazing
Entrance ticket Rp 8,000
Parking ticket Rp 5,000
Access to the location is still a rocky road but not overly difficult
Many vendors so no need to worry about food or drinks","nature, ticket, ticket, road, food, drink","positive, neutral, neutral, negative, positive, positive","rocks, ticket, ticket, road, food, drinks"
9fa7267c63fc48cb978b3629c00d2d7f,2022-12-23 18:34:22,Orchid Forest Cikole,"Tempatnya enak banget tenang, dingin, utk istirahat sejenak dr kepadatan ibukota.
Sambil minum yg hangat ato makan yg hangat2 mantap.
Pemandangannya oke
Ada flying fox, kasi makan kelinci, spot foto, dll
Jenis anggreknya tidak terlalu banyak
Namun jalanannya masi banyak lobang2",5,negative,neutral,negative,"The place is very nice, quiet, and cool, for a short break from the capital's density.
While drinking something warm or eating something warm is great.
The view is okay.
There's a flying fox, feeding rabbits, photo spots, etc.
The variety of orchids isn't too much.
However, the roads still have many potholes.","place, quietness, drink, food, view, attraction, photo, nature, road","positive, positive, positive, positive, neutral, positive, positive, negative, negative","place, quiet, drinking, eating, view, flying fox, photo spots, orchids, roads"
64f995c38c644c7ead42d9fb3245ca14,2022-09-23 18:22:16,Terminal Wisata Grafika Cikole,Bermain ala outbound...senang2...bagus buat gathering kantor...sejuk..bagusnya rombongan...ada kemping..dll...wc ok...hanya mushola kecil...kalau buat rombongan antri dulu...tempat wudhu tidak terpisah antara pria n wanita...tapi look nya bagus...kalau jalan2 asri pegunungan...,5,neutral,positive,positive,"Playing in an outbound style...fun...good for office gatherings...cool...good for groups...there's camping...etc...toilets okay...only a small prayer room...if for a group, you'll have to queue first...the ablution area isn't separated for men and women...but the look is good...if you're looking for a natural, mountainous getaway...","activity, entertainment, facility, facility, facility, restroom, restroom, restroom, scenery, nature, mountain","positive, positive, positive, positive, positive, neutral, neutral, negative, negative, positive, positive","outbound, gatherings, camping, toilets, prayer, ablution, look, natural, mountainous, nature, mountain"
f2e7360dfb1e4249afbd4e45dde03455,2023-01-15 13:04:03,Taman Lembah DEWATA,"Seru sejuk banget.. bisa keliling area pakai kereta2an, tp bayar lagi, driver kereta2annya baik bgt suka nawarin moto2in😁 tiket masuk bisa ditukar air mineral, atau minuman lain (susu murni/es podeng/teh poci) tp dikenakan biaya tambahan.. cocok tuk destinasi rekreasi keluarga …",5,neutral,neutral,positive,"Very cool and refreshing.. can tour the area using the train, but it costs extra, the train driver is very kind and likes to offer to take photos 😁 entrance tickets can be exchanged for mineral water, or other drinks (pure milk/es podeng/teh poci) but with an additional charge.. suitable for family recreation destinations…","transportation, price, staff, ticket, drink, attraction","positive, negative, positive, neutral, neutral, positive","train, extra, driver, tickets, drinks, recreation"
3a6d6e047bc44219bc09ab0daf1297dd,2020-02-15 13:28:43,Stone Garden,"Jalan masih belum bagus, meskipun mobil bisa masuk. Masuk 8000, parkir motor 5000 mobil 1000, camping 25000 per orang, pre wed 300
Hati hati dengan barang bawaan terutama makanan. Karena banyak kawanan monyet yang mengincar makanan. Klo bisa jangan buang sisa makanan di sekitar.",5,negative,neutral,neutral,"The road is still not good, although cars can enter. Entrance fee 8000, motorcycle parking 5000, car parking 1000, camping 25000 per person, pre-wedding shoot 300.
Be careful with your belongings, especially food, because there are many troops of monkeys eyeing food. If possible, do not leave leftover food lying around.","road, entrance, parking, parking, parking, food, safety","negative, neutral, neutral, neutral, neutral, negative, negative","road, Entrance, parking, parking, parking, food, belongings"
7434e326e7b142a193adb6520b210962,2021-02-15 14:13:08,Sanghyang Kenit,"Goa di daerah Rajamandala. Aliran sungai Citarum Purba. Kenit/Kedit memiliki arti melingkar. Karena jika diperhatikan dengan baik, bentuk dari Goa yaitu melingkar/bulat. Begitupun ketika aliran Sungai Citarum Purba ketika keadaan normal, arusnya berbentuk melingkar dan berputar.",5,neutral,neutral,neutral,"Goa in the Rajamandala area. The flow of the Purba Citarum River. Kenit/Kedit means circular. Because if observed carefully, the shape of the cave is circular/round. Likewise, when the Purba Citarum River flows under normal conditions, its current is circular and swirling.","river, river, nature, nature, attraction, attraction","neutral, neutral, neutral, neutral, neutral, neutral","River, River, nature, nature, cave, cave"
c4d7c724544c41d2976b0ecfec83a1f4,2019-02-23 18:05:26,Gunung Tangkuban Parahu,Akses jalan nya udah bagus..  Pake aspal.. Bisa bawa mobil sampe atas perbukitan.. Sampe lokasi banyak kudakuda buat kita keliling tempat wisata..  Bisa juga jalanjalan sampai atas mulut gunung..  Dari atas bakalan dapet view yang bagus..  Dan bisa liat kawah nya dengan jelass..,5,positive,neutral,neutral,"The road access is already good.. It's paved.. You can drive a car all the way up the hills.. Upon arrival, there are many horses available for you to explore the tourist attractions.. You can also walk all the way up to the mouth of the mountain.. From the top, you'll get a good view.. And you can see the crater clearly..","road, attraction, walking, view, mountain","positive, positive, positive, positive, positive","road, attractions, walk, view, mountain"
bd6a2458563844bab4dc54ea8fe84cd3,2022-12-23 17:57:53,Floating Market Lembang,Seru seruan anak anak. Dari punya anak 1 sampe 2. Dari anak pergi di 2018. 2019.2022. Ga tau kenapa santai aja jalan kesini anak mamak bapak bisa jajan di pinggiran sungai. Tutut sate cuanki gada gada cireng tujuannya.... sisanya anak2 main emak duduk aje santai sambil merkatiin,5,neutral,neutral,neutral,"Kids having fun. From having 1 to 2 children. Since the children left in 2018. 2019. 2022. Don't know why, we just casually walked here, mom and dad's kids can snack by the river. Tutut, satay, cuanki, gado-gado, cireng, the goal is... the rest of the time the kids play, mom just sits relaxed while watching them.","crowd, nature, food, food, food, food, food, food, entertainment, activity, place, staff","positive, positive, positive, positive, positive, positive, positive, positive, positive, positive, neutral, neutral","kids, river, satay, cuanki, gado-gado, cireng, snack, tutut, play, fun, here, mom"
9d4a0cdef08443779963f3e7bb2e2d8f,2023-02-16 17:58:34,Floating Market Lembang,"Saya dah 2x kesini, so Far bisa bikin anak2 sy happy kok... Cm yg agak kurang nyaman parkirannya aja, kl pas penuh dpt parkiran dilapangan yg becek, krn tanah gt.. Tp utk tempatnya bagus suasananya... Recomended dg harga tiket masuk yg standart murah, cm gak boleh bawa makanan...",5,neutral,negative,positive,"I've been here twice, and so far, it's made my kids happy. The only thing that's a bit uncomfortable is the parking. When it's full, you get parking on a muddy field because it's dirt. But the place itself is nice, and the atmosphere is good. Recommended for the standard cheap entrance fee, but you can't bring your own food.","parking, place, atmosphere, ticket, food","negative, positive, positive, neutral, negative","parking, place, atmosphere, entrance, food"
e914dd8d95cc45608033d03f3f9f532b,2023-02-01 12:39:04,Sarae Hills,"Tempatnya keren utk yg hobby koleksi foto2. Petugasnya juga ramah2. Area nya bersih. Sedikit saran, petugas hendaknya mengingatkan pengunjung utk tidak berlama lama ambil foto, jd bisa bergantian dgn pengunjung lain.
Saya berharap nanti saya kesana lagi ada spot terbaru lagi. 😊😊😊",5,neutral,positive,positive,"The place is cool for those who enjoy collecting photos. The staff are also friendly. The area is clean. A small suggestion, the staff should remind visitors not to take too long to take photos, so they can take turns with other visitors. I hope when I go there again, there will be new spots. 😊😊😊","place, photo, staff, cleanliness, staff, photo, spot","positive, positive, positive, positive, neutral, negative, positive","place, photos, staff, area, staff, photos, spots"
8630290c25aa4bd79c127c0f74ac9f16,2022-12-23 18:34:27,Orchid Forest Cikole,"Gag terpikir tempat wisata ini sangat dikelolah dengan baik.
Rapih, tertata dengan baik, bersih, tersedia toilet cukup, wastafel cuci tangan yang tersebar disemua area.
Cocok untuk orang pacaran dan yang berkeluarga bawa anak kecil. Bisa main putt putt golf murah seharga 10 ribu.",5,neutral,positive,neutral,"I never thought this tourist spot would be so well managed.
Neat, well-organized, clean, with sufficient toilets and handwashing sinks spread throughout all areas.
Suitable for couples and families with young children. You can play cheap putt-putt golf for 10 thousand.","spot, management, cleanliness, restroom, facility, activity","positive, positive, positive, positive, positive, positive","spot, managed, clean, toilets, sinks, putt-putt"
bc28328f1ffa4123ac07a7433f45f06a,2019-02-15 13:48:43,Curug Maribaya,"Tempat wisata alam yg sejuk di Matibaya, daerah Lembang inisdh lama terkenal namun setelah di renobasi ulang tempatnya semakin menarik dan udara alam yg sejuk membantu melepaslan penat. Banyak tempat atau spot indah utk berfoto selfie atau bersama keluarga sebagai momen yg indah.",5,neutral,neutral,positive,"Matibaya's cool natural tourist spot, in the Lembang area, has long been famous. However, after renovations, the place has become even more attractive, and the cool natural air helps relieve fatigue. There are many beautiful places or spots for selfies or with family for beautiful memories.","spot, place, air, spot, attraction","positive, positive, positive, positive, positive","spot, place, air, spots, attractive"
166ea54e261847c59e225e9a10cc40ca,2019-02-15 13:28:38,Stone Garden,"Tenpatnya bagus mudah dijanhkau banyak batuan2 kapur yg bagus, parkiran luas. Jam buka hingga pukul 18.00. Makanan disini murah2. Masih alamo sehingga banyak monyet di stone gardennya. Hati2 yg pake perhiasan mending dicopot. Sunsetnya bagus bgt sampe d kamera ho gak dpt bagusnya",5,neutral,neutral,positive,"The place is good and easy to reach with many beautiful limestone rocks and a spacious parking lot. It's open until 6:00 PM. The food here is cheap. It's still natural, so there are many monkeys in the stone garden. Be careful if you're wearing jewelry, it's best to take it off. The sunset is very beautiful, even the camera couldn't capture its beauty.","place, parking, food, nature","positive, positive, positive, positive","place, parking, food, natural"
d1d02afc6b654bc98b7112f9c7818df5,2022-03-15 13:22:45,Gunung Putri Lembang,"Mudah dijangkau, lokasi cukup bagus buat kemping dengan track menuju camping ground yang lumayan menanjak, , toilet ada di tiap kemping ground, sayang musholla kurang terawat dan banyak anak muda yang berisik banget, sampai malem pada berisik, tidak menghormati pengunjung lain...",4,positive,negative,neutral,"Easily accessible, the location is quite good for camping with a rather steep track leading to the camping ground. Toilets are available at each camping ground. Unfortunately, the prayer room is poorly maintained, and many noisy young people are very loud until late at night, not respecting other visitors.","accessibility, location, trail, restroom, facility, crowd, noise","positive, positive, negative, positive, negative, negative, negative","accessible, location, track, toilets, prayer room, young people, loud"
32ca2883a68e4530b0dc7bebf0da9521,2022-07-23 18:22:50,Terminal Wisata Grafika Cikole,"Udaranya sangat segar, air dingin dan sejuk, pemandangan hijau, ada permainan seperti flying fox, tempat berkemah, tempat menginap juga, cocok untuk perusahaan yang ingin capasity building. Tapi ada sebagian lokasi yang masih belum 100% jadi, masih dibangun. Kurang Instagrammable",4,neutral,positive,negative,"The air is very fresh, the water is cold and cool, the scenery is green, there are games like flying fox, camping spots, and accommodation available. It's suitable for companies looking for capacity building. However, some areas are still under construction and not yet 100% complete. It's not very Instagrammable.","air, water, scenery, activity, spot, accommodation, place, facility","positive, positive, positive, positive, positive, positive, positive, neutral","air, water, scenery, games, spots, accommodation, suitable, areas"
4337c15c690746b5aa9e64fec0eb815c,2022-10-23 17:57:44,Floating Market Lembang,"Pelayan ramah, areanya sangat luas.. Bagus dan indah sampe pegel muter muter.. Cuma mungkin untuk harga wahana (baik kota mini /floating market ) agar lebih murah karena saya rasa tidak sesuai dengan experience nya, atau bisa ditambah keseruannya agar setimpal dengan yg dibayar..",4,neutral,positive,positive,"The staff is friendly, the area is very spacious.. It's so good and beautiful that my feet hurt from walking around.. It's just that maybe the price of the attractions (both mini town / floating market) could be cheaper because I feel it doesn't match the experience, or maybe add more fun so it's worth what you pay..","staff, spaciousness, price, attraction, entertainment","positive, positive, negative, neutral, neutral","staff, area, price, attractions, experience"
11a2b81171d148f5b7828a65068acb22,2020-02-23 18:04:48,Gunung Tangkuban Parahu,"Aman dan nyaman,
Hanya saja saya kurang mengerti,
Karcis masuk kendaraan roda empat, karcis masuk pengunjung nusantara,
Penataan parkir, semuanya jelas,
Tapi ko kadang petugas diatas masih meminta uang parkir, apakah mereka pekerja disitu? Dan harus berapa kali kami bayar parkir?",2,neutral,positive,neutral,"Safe and comfortable,
It's just that I don't quite understand,
Vehicle entry ticket, domestic visitor entry ticket,
Parking arrangement, everything is clear,
But why do the officers above sometimes still ask for parking fees? Are they workers there? And how many times do we have to pay for parking?","safety, comfort, ticket, parking, parking, staff","positive, positive, neutral, neutral, negative, neutral","Safe, comfortable, ticket, arrangement, fees, officers"
2c97a7a5784c4c349c4a1b1dc55569d0,2020-02-23 18:12:56,Ciwangun Indah Camp (CIC),"Untuk akses masuk jalan nya kurang baik agak rusak ... Tiket masuk kedalam murah dan banyak sekalia tempat area datar baik untuk camp, kegiatan komunitas dan lainnya .. selain itu juga ada beberapa wahana outbond ada mushola dan tempat istirahat atau makan.. parkiran cukup luas..",5,negative,positive,positive,"The access road is not good, it's a bit damaged... The entrance ticket is cheap and there are many flat areas, good for camping, community activities, and more.. Besides that, there are also some outbound rides, a prayer room, and places to rest or eat.. The parking lot is quite spacious..","road, ticket, parking, restroom, place","negative, positive, positive, positive, positive","road, ticket, parking, prayer room, places"
0d5c02124cfa4bbab4775b98a53f3e2a,2020-02-23 18:22:25,Terminal Wisata Grafika Cikole,"Sejuuuuuuukkkk bgt tempatnya. Referensi untuk keluarga, acara kantor, dan honeymoon😋
Ada wahana outbound (flyingfox dll), kebun strowberry yg bisa metik, makanannya pun enak dan harganya terbilang terjangkau lah ya (start 15rb-70rb).
Tempat tidurnya enak, dingin banget, worth it!",5,neutral,positive,positive,"The place is very cool. Recommended for families, office events, and honeymoons😋
There are outbound rides (flying fox, etc.), a strawberry garden where you can pick them, and the food is also delicious and the prices are quite affordable (starting from 15k-70k).
The beds are comfortable, it's very cold, worth it!","place, food, price, comfort, atmosphere","positive, positive, positive, positive, positive","place, food, prices, beds, cold"
f5fcb3e09e0141c4b01e6fe606ef3ad3,2022-02-23 18:35:10,Orchid Forest Cikole,"Tempat yang sangat cocok untuk yang mencari wisata alam. Tenpatnya sejuk, tenang dan indah. Banyak spot foto dan permainan. Bisa untuk tempat wedding juga. Harga sangat terjangkau. Di sediakan kendaraan saat pulang untuk kembali ke tempat parkir. Sayang jalan kendaraan agak rusak",5,negative,positive,positive,"A very suitable place for those looking for nature tourism. The place is cool, quiet, and beautiful. Many photo spots and games. It can also be a wedding venue. The price is very affordable. A vehicle is provided for the return trip to the parking lot. It's a shame the road for vehicles is a bit damaged.","place, nature, photo, price, parking, road","positive, positive, positive, positive, positive, negative","place, nature, photo, price, parking, road"
f03d0dd707dc40c38ef54da7e068d466,2023-01-15 13:22:46,Gunung Putri Lembang,"Gunung putri lembang ini tidak jauh dari kota Bandung. Hanua saja jika ingin datang ketempat ini sebaiknya pagi hari untuk menghindari macet. Selain itu datang dipagi hari lebih menyenangkan, karena kita bisa menikmati pemandangan yg luar biasa indah dan menghirup udara yg segar.",5,positive,neutral,positive,"This Lembang mountain area is not far from Bandung city. However, if you want to come here, it's best to come in the morning to avoid traffic jams. Besides, coming in the morning is more pleasant because we can enjoy the incredibly beautiful scenery and breathe the fresh air.","location, weather, scenery, air","neutral, neutral, positive, positive","area, morning, scenery, air"
323daa1f5e064971ac6dc326198d49b4,2022-05-15 12:39:28,Sarae Hills,"tempatnya banyak disatu tempat, bawah sarae hills atas ada d'dieuland, sudut pandang dan lainnya. sarae hillsnya tempatnya adem dan luas, tempatnya bagus, pegawainya ramah banget dan mau bantu foto, ada beberapa tempat duduk, dan bisa ditukar minuman, shuttle nya juga cepat banget",5,positive,neutral,positive,"The places are many in one location, below is Sarae Hills, above is D'Dieuland, viewpoint, and others. Sarae Hills is cool and spacious, the place is nice, the staff are very friendly and willing to help take photos, there are several places to sit, and you can exchange it for drinks, the shuttle is also very fast.","place, location, attraction, place, staff, photo, place, drink, transportation","positive, positive, positive, positive, positive, positive, positive, positive, positive","places, location, Sarae Hills, place, staff, photos, places, drinks, shuttle"
af647459c0ac4d72bc2930087be2c03a,2023-01-15 13:43:36,Sanghyang Heuleut,"Tiket 20rb mbl 10rb. Jalur trekingnya bagus cukup menantang dan jauh. Lebih baik ke sini kalau tidak hujan beberapa hari karna tanah nya nempel di sepatu pdhal kemaren2 gujan juga sebentar. Ĺebih baik pagi2, kalau siang sudah byk org. Ga nyaman. Buat foto2. Seru kalau bawa anjing.",4,positive,neutral,positive,"Ticket 20rb, car 10rb. The trekking path is good, quite challenging and long. It's better to come here if it hasn't rained for a few days because the mud sticks to your shoes, even though it rained a little yesterday. It's better to come early in the morning; if you come during the day, there will be many people, which is uncomfortable. Good for taking photos. It's fun if you bring a dog.","ticket, parking, trail, weather, crowd, photo, activity","neutral, neutral, positive, negative, negative, positive, positive","ticket, car, path, rained, people, photos, fun"
8a65ba2bbd3f4616850d1f5555eb9715,2023-01-23 18:34:07,Orchid Forest Cikole,"Konsepnya sangat bagus untuk dibuat jalan jalan seharian ga akan terasa karena banyak spot khususnya utk pecinta tanaman ataupun wisata alam yg ringan, tempatnya luas, bersih, banyak wahana dan spot2 foto yg sayang untuk dilewatkan, masih pengen ksana lagi bareng keluarga nantinya",5,neutral,positive,positive,"The concept is very good for a day trip, it won't feel long because there are many spots, especially for plant lovers or light nature tourism. The place is spacious, clean, has many attractions and photo spots that would be a shame to miss. I still want to go back there with my family later.","atmosphere, place, attraction, photo, nature","positive, positive, positive, positive, positive","concept, place, attractions, photo, nature"
