id,datetime,location,text,rating,accessibility,facility,activity,english_translation,aspects,sentiment,real_aspect
176332ecc1ac40f59035a603ecd496a6,2020-02-23 17:58:17,Floating Market Lembang,"Tempatnya bagus, luassss banget tp nggak bikin capek karena dimanjakan dg pemandangan yg ciamik, banyak bunga2 cantik, terdapat miniatur kota dan floating market tentunya, dijamin nggak akan bosen lama2 disini. Selain itu tiket dapat ditukarkan dg segelas susu hangat. Cocok banget dg hawa dingin lembang",5,neutral,positive,positive,"The place is nice, very spacious but not tiring because you're pampered with amazing views, lots of beautiful flowers, a miniature city, and of course a floating market, guaranteed you won't get bored here for long. Besides that, the ticket can be exchanged for a glass of warm milk. It's very suitable for the cold Lembang air.","place, spaciousness, view, nature, attraction, attraction, attraction, ticket, drink, air","positive, positive, positive, positive, positive, positive, positive, positive, positive, positive","place, spacious, views, flowers, city, market, here, ticket, milk, air"
782a561a900a47b9a55864a1a6b903f6,2020-02-15 13:48:52,Curug Maribaya,"Kirain bisa main-main di curugnya, ternyata ngga. Kalopun bisa, paling di batu-batu dan ga puas karena ga leluasa. Di beberapa sudut curug ada sampah plastik. Curugnya juga termasuk kecil menurut gue. Harga masuk 35 rb udh termasuk liat curug, mini zoo, air mineral atau pie susu. Harga masuk motor 5 rb.",2,neutral,neutral,negative,"I thought I could play around in the waterfall, but it turns out I can't. Even if I could, it would probably just be on the rocks and unsatisfying because I wouldn't be able to move freely. In some corners of the waterfall, there was plastic trash. The waterfall is also quite small in my opinion. The entrance fee of 35,000 includes seeing the waterfall, the mini zoo, mineral water, or milk pie. The motorbike entrance fee is 5,000.","water, place, attraction, entrance, ticket, facility, facility","negative, negative, negative, negative, neutral, neutral, neutral","waterfall, waterfall, waterfall, entrance, fee, water, pie"
3bafa5bca3db4d0db0e0b4ae07641ebb,2021-02-23 18:05:03,Gunung Tangkuban Parahu,"Wah gabisa diungkapan dengan kata2 deh, pokoknya takjub banget liatnya buat yg gapernah liat kawah gunungyg aktif. Harga tiketnya (6/9/20) 30k, Parkir motor 19k.
Di kawasan ini, selain kaeah ratu (utama) da banyak kawah lainnya juga, dan katanya masuk lagi kedalemnyaa. Jalur kesana jalannya bagus sekali",5,positive,neutral,neutral,"It can't be described with words, I was just so amazed to see it, especially for those who have never seen an active volcano crater. The ticket price (6/9/20) was 30k, motorcycle parking was 19k.
In this area, besides the main crater (Kawah Ratu), there are many other craters as well, and they say you can go deeper inside. The path there is very good.","attraction, ticket, price, parking, path","positive, neutral, neutral, neutral, positive","volcano, ticket, price, parking, path"
feb8d162451b4301b5bb1d9fb0cf5e58,2019-02-23 18:22:34,Terminal Wisata Grafika Cikole,"Seru cocok untuk liburan keluarga, untuk anak2 karena ada outbound nya.
Toiletnya bersih, musholanya  oke. Ada kebun strawberry, rusa, outbound, vila, camping dll. Luas banget tempatnya dan kemaren belum sempat eksplore semua spot nya... Buat rombongan juga cocok, masakan restauran nya juga lumayan enak",5,neutral,positive,positive,"Exciting, suitable for a family vacation, especially for kids because there's an outbound activity.
The toilets are clean, the prayer room is okay. There's a strawberry garden, deer, outbound activities, villas, camping, etc. The place is very spacious, and we didn't have time to explore all the spots yesterday... It's also suitable for groups, and the restaurant's food is quite delicious.","activity, restroom, garden, nature, facility, spaciousness, spot, food, restaurant","positive, positive, neutral, positive, positive, positive, positive, positive, positive","outbound activity, toilets, prayer room, strawberry garden, deer, villas, place, spots, groups"
8bed75d6abcd4e7585b397b36a375500,2020-02-23 18:12:57,Ciwangun Indah Camp (CIC),"Tempatnya enak buat camp..tapi pelayanannya kurang baik..kalo maen aja kesini ticketnya 10rb..saya mau camp pas masuk gak ada harga buat camp to di tagih 30rb /orang, 5 org jadi 150rb..yg lebih parahnya gak di kasih ticket / bukti pembelian ticket buat camp..gak tau tuh dana yg kita bayar masuk kemana..",3,neutral,negative,neutral,"The place is nice for camping, but the service is not good. If you're just visiting, the ticket is 10,000 IDR. I wanted to camp, and when I arrived, there was no price listed for camping, but they charged me 30,000 IDR per person. For 5 people, that was 150,000 IDR. What's worse is they didn't give us a ticket or proof of purchase for the camping fee. I have no idea where the money we paid went.","place, service, ticket, price, ticket, price","positive, negative, neutral, negative, negative, negative","place, service, ticket, price, ticket, price"
40586c91bbdf419aa0e23877b5c5c55c,2021-02-15 13:04:14,Taman Lembah DEWATA,"tempat wisata di daerah lembang Bandung dengan suasana tematik yang asri dan banyak tempat bermain, ada labirin, sepeda danau, kereta api keliling, berkuda. Terdapat banyak spot untuk berfoto-foto bersama kekasih, teman, dan keluarga. Lahan wisata yang luasnya kurang lebih 70 hektar, luas tempat parkir.",5,neutral,positive,positive,"A tourist spot in the Lembang Bandung area with a beautiful thematic atmosphere and many play areas, including a maze, swan boats, a miniature train, and horse riding. There are many photo spots to take pictures with your lover, friends, and family. The tourist area is approximately 70 hectares, with ample parking space.","attraction, atmosphere, spot, photo, parking, spaciousness","positive, positive, positive, positive, positive, positive","spot, atmosphere, spots, photo, parking, space"
f3a1383b28964ae390c02f4289bf7695,2022-08-15 12:39:48,Sarae Hills,"kawasan dengan berbagai resto dengan tema berbeda, bagus untuk dijadikan spot foto, tiap resto mesti beli voucher dulu, sayang, akses ke sini jalan terlalu sempit, harusnya ada rekayasa arus dari atas dan dari bawah, kayanya akses jalan dari dago (jl citra green) lebih nyaman dari pada lewat ciumbuleiut",5,negative,neutral,positive,"an area with various restaurants with different themes, good for taking photos, you have to buy a voucher first at each restaurant, too bad, the access road here is too narrow, there should be traffic engineering from above and below, the road access from Dago (Jl Citra Green) seems more comfortable than going through Ciumbuleuit","restaurant, photo, road, road, transportation","positive, positive, negative, positive, neutral","restaurants, photos, road, access, road"
35217f4f15594cfa8df343552ebd5ab2,2022-02-15 12:39:31,Sarae Hills,"Bagus tempatnya..
Tapi buset deh pop mie beli di dalem harganya 18.000, pop mienya ada lapisan emasnya kali ya... perasaan pop mienya sama air panasnya juga sama, apa jangan2 air panasnya dimasak di neraka ?, gilak kali, udah bayar tiket masuk jajanan harganya selangit, mikir2 deh kalo mo jajan disitu !",5,neutral,negative,positive,"The place is nice...
But wow, the Pop Mie bought inside costs 18,000, maybe the Pop Mie has a layer of gold on it... I feel like the Pop Mie and the hot water are the same, or maybe the hot water was cooked in hell? Crazy, you've already paid for the entrance ticket and the snacks are outrageously priced, think twice if you want to snack there!","place, price, price, ticket, facility","positive, negative, negative, negative, negative","place, Pop Mie, Pop Mie, ticket, snacks"
ec041d27f174453cbe9972feb09f7693,2022-02-23 18:21:58,Terminal Wisata Grafika Cikole,Keren..sejuk cocok untuk jalur tracking jalan kaki...ada penginapannya juga ..tiket 25rb/org bisa naik flaying fox..20rb/org bisa ditukar sama makanan manis/asin..semua keren hanyab1 kritik sy buat managemen tolong buat t4 wudhu wanita yg tertutup dan ketersedian  mukena yg bersih ...baarakallahu fiikum,5,neutral,negative,neutral,"Awesome...cool, suitable for walking/hiking trails...there's also accommodation...ticket is 25k/person, can include a flying fox ride...20k/person can be exchanged for sweet/savory food...everything is awesome, I only have 1 critique for management, please make closed ablution places for women and provide clean prayer garments...may Allah bless you.","trail, accommodation, ticket, food, management","positive, positive, neutral, positive, negative","trails, accommodation, ticket, food, management"
492e89d2fcfe423da8e53ea15b78c40b,2022-07-15 13:04:02,Taman Lembah DEWATA,"Masih banyak pembangunan dan masih sepi, harga tiket masuk masih 20.000 untuk weekday dan 25.000 untuk weekend
Bisa naik kuda, bebek""an, lihat kuda poni, tapi untuk weekdays food vendorsnya sedikit sekali. Tiket masuk bisa ditukar air mineral botol kecil atau dengan tambah 3000 bisa diuprade ke Teh Poci",5,neutral,neutral,positive,"There is still a lot of development and it is still quiet, the entrance ticket price is still 20,000 for weekdays and 25,000 for weekends.
You can ride horses, pedal boats, see ponies, but for weekdays, there are very few food vendors. The entrance ticket can be exchanged for a small bottled mineral water or by adding 3,000 you can upgrade to Teh Poci.","quietness, ticket, price, activity, food, drink","neutral, positive, neutral, neutral, positive, negative","development, quiet, ticket, price, ride, food"
679ba8a8488a470381d92bda3101b131,2019-02-23 18:22:18,Terminal Wisata Grafika Cikole,"Tempatnya enak cocok untuk acara gathering dan acara keluarga. Paket camping di tenda nya nyaman fasilitasnya juga ada dispenser dan air galon, ada colokan, ada api unggun dan dapet jagung bakar+pop mie, free parking. Kalo weekend disini rame banget jadi kalo mau sepi sepi disini lebih baik weekday aja.",4,neutral,positive,positive,"The place is nice, suitable for gatherings and family events. The tent camping package is comfortable with facilities like a dispenser and gallon water, power outlets, a bonfire, and includes grilled corn + instant noodles, plus free parking. It gets very crowded here on weekends, so if you want peace and quiet, it's better to come on weekdays.","place, accommodation, facility, water, facility, parking, crowd, quietness","positive, positive, positive, positive, positive, positive, negative, positive","place, camping, facilities, water, dispenser, parking, weekends, quiet"
62d5c75eaecb406ca55a9e1fa6409145,2022-06-15 12:57:05,Kebun Begonia Lembang,"Bersyukur sekali ada trip kesini dari sekolah anakku, katanya seruuu, baguss banyak bunga, foto-foto teruss sama temen-temennya.. Ga terlalu bikin cape jalan-jalan, banyak spot foto-foto, bunganya seger-seger dan terawat, parkir luas, mushola dan toilet juga tersedia,. Cocok jadi rekomendasi liburan 🎉 …",5,neutral,positive,positive,"So grateful there was a school trip here for my child. They said it was super fun, beautiful, lots of flowers, and they took tons of photos with their friends. It wasn't too tiring to walk around, there were many photo spots, the flowers were fresh and well-maintained, parking was spacious, and a prayer room and toilets were also available. Suitable as a holiday recommendation 🎉 …","place, photo, nature, maintenance, parking, restroom, accommodation","positive, positive, positive, positive, positive, positive, positive","here, photos, flowers, well-maintained, parking, prayer room, holiday"
b4ac1ab6ecac4c36b495fbaf92dc8977,2022-04-15 13:04:21,Taman Lembah DEWATA,Destinasi rekreasi yang cocok untuk keluarga. Ada sewa sepeda yang bisa di pakai sepuasnya. Naik kereta mobil dan naik kuda bisa menjadi alternatif keliling lembah. Spot swafhoto yang menarik dan lokasi lembah yang mudah di jangkau serta lembah yg luas. Ada juga danau yang di lengkapi dengan sepeda air.,5,neutral,neutral,positive,"A recreation destination suitable for families. There is unlimited bicycle rental available. A car train ride and horseback riding can be alternatives for touring the valley. Interesting photo spots, an easily accessible valley location, and a spacious valley. There is also a lake equipped with paddle boats.","facility, transportation, activity, attraction, spot, accessibility, spaciousness, facility, attraction","positive, positive, positive, positive, positive, positive, positive, positive, positive","recreation, bicycle, car, horseback, photo, valley, valley, lake, paddle boats"
61e490be186946ad95ce470ce72db6df,2022-02-15 14:15:31,Bukit Senyum,"Tempat nya bagus,tersedia toilet dan mushola, pemandangan nya bagus juga.
Banyak tempat untuk makan bersama keluarga, flying fox, ayunan, dan permainan anak
Tiket 5000 masih murah meriah.

Kekurangan cuman diperjalanan menuju kesana, beberapa titik masih jalan berbatu/rusak. Tapi hanya beberapa titik aja",5,negative,positive,positive,"The place is nice, with toilets and a prayer room available, and the view is also good.
There are many places to eat with family, flying fox, swings, and children's games.
The ticket price of 5000 is still very affordable.

The only drawback is the journey there, with some sections still having rocky/damaged roads. But it's only a few sections.","place, restroom, view, food, ticket, price, road","positive, positive, positive, positive, positive, positive, negative","place, toilets, view, eat, ticket, price, roads"
9d36f8a37a534b389c74f6b19d6f54d8,2022-02-15 12:25:30,Curug Tilu Leuwi Opat,"
Tempat yang sangat menarik untuk dikunjungi karena mereka memiliki beberapa jenis air terjun yang berbeda juga masih banyak monyet liar di sekitar area tersebut.
Mereka memiliki jalur pelacakan yang sangat panjang ke dalam hutan, sedikit menyeramkan tapi menurut saya masih layak untuk aktivitas keluarga",4,neutral,neutral,positive,"A very interesting place to visit because they have several different types of waterfalls and still many wild monkeys around the area. They have very long tracking paths into the forest, a bit spooky but I think it's still worth it for family activities.","place, nature, trail, activity","positive, positive, negative, positive","place, waterfalls, paths, activities"
951fc94c06144389bc339f577d69473e,2022-11-23 18:34:04,Orchid Forest Cikole,"datang pas mepet bgt closing ticket, but overall puas, lumayan buat healling walau cuma sebentar.. toilet bersih, harga makanan di area parkir masih tergolong standart (gatau ya kalau yang di dalam).. gausah khawatir cape, karena nantinya ada mobil jemputan untuk pickup kita dari pintu keluar ke parkiran",4,neutral,positive,positive,"Arrived just before ticket closing, but overall satisfied, quite healing even though it was short.. the toilet was clean, food prices in the parking area are still considered standard (don't know about inside).. no need to worry about getting tired, because there will be a shuttle car to pick us up from the exit to the parking lot.","ticket, restroom, food, price, parking, parking, transportation","neutral, positive, positive, neutral, neutral, neutral, neutral","ticket, healing, toilet, food, prices, parking, parking"
a756bc39d70641e1b2425712ac8c7c54,2019-02-15 12:57:28,Kebun Begonia Lembang,"Tempatnya unik banyak bebungaan cuma tidak  terlalu besar.  Dan sayang kalau datang musim hujan dingin sekali dan ga bisa foto dong kena hujan. Taman bunganya ada resto untuk berteduh, menyajikan kopi,  teh, bandrek minuman khas bandung? Snack dan makanan berat seperti nasi goreng. Ada kebun tomat cherry",5,neutral,neutral,positive,"The place is unique with many flowers, but not too big. And it's a shame if you come during the rainy season because it's very cold and you can't take photos because of the rain. The flower garden has a restaurant to shelter in, serving coffee, tea, bandrek, a typical Bandung drink, snacks, and heavy meals like fried rice. There is a cherry tomato garden.","place, nature, weather, photo, food, drink, accommodation","positive, positive, negative, negative, positive, positive, positive","place, flowers, rainy season, photos, meals, drink, restaurant"
db41352271eb4d52b246f67837817cf5,2022-07-15 13:22:45,Gunung Putri Lembang,"Sudah dua kali nge camp di gunung putri Lembang. Emang rasanya ingin kembali lagi nge camp disana... Udaranya sejuk, untuk mencapai tempat nge camp juga tidak terlalu jauh dari tempat parkir, cocok untuk nge camp keluarga.
Sekarang di atas sudah ada sarana MCK dan Musholla, jadi membuat tenang l, hehe...",5,neutral,positive,positive,"I've camped twice at Gunung Putri Lembang. I really want to go camping there again... The air is cool, and getting to the campsite isn't too far from the parking lot, making it suitable for family camping.
Now there are bathroom and prayer room facilities available, which is reassuring, hehe...","air, parking, facility, facility","positive, positive, positive, positive","air, parking, bathroom, prayer room"
11b6d63d989a48488f9d5b1d4815f0dc,2019-02-23 18:34:59,Orchid Forest Cikole,"Datanglah pagi2 segar, adem, dan masih sepi. Mushollanya bagus, bagus dan unik. Desain mushollanya suka deh. Untuk duduk2 maupun main nyaman dan seru. Ada juga panggung untuk acara ttt. Panggung yg kl dpake serasa lg manggung ditengah hutan yg rapi. Tpt kelincinya juga bersih ada keran u tpt cuci tangan.",5,neutral,positive,positive,"Come early morning, it's fresh, cool, and still quiet. The prayer room is nice, good, and unique. I really like the prayer room's design. It's comfortable and fun for sitting around or playing. There's also a stage for events. When used, the stage feels like you're performing in the middle of a neat forest. The rabbit enclosure is also clean, with a faucet for handwashing.","quietness, restroom, atmosphere, facility, facility, nature","positive, positive, positive, positive, positive, positive","quiet, prayer room, stage, rabbit enclosure, faucet, forest"
46205fc81e0842e8b2feae7ccb133bd5,2020-02-15 13:48:42,Curug Maribaya,"Jalan-jalan ke Tahura akan terasa lengkap jika sampai ke Curug Omas. Kalau di papan petunjuk awal jarak dari pintu pos 2 sampai ke tahura sekitar 4.3 KM. Jauh tapi terbayarkan dengan pemandangan yang menyenangkan. Lengkap rasanya setelah berjalan jauh, bisa duduk santai sambil menikmati bunyi air terjun.",5,neutral,neutral,positive,"A trip to Tahura would feel complete if you reached Curug Omas. According to the initial signpost, the distance from the pos 2 entrance to Tahura is about 4.3 KM. It's far, but the pleasant scenery makes it worthwhile. It feels complete after a long walk, being able to sit back and enjoy the sound of the waterfall.","attraction, entrance, scenery, walking","positive, neutral, positive, neutral","Curug Omas, entrance, scenery, walk"
43208d7a34134902bfa99cfcdc741b04,2022-07-15 14:08:58,Curug Cimahi / Curug Pelangi,"Cocok untuk refreshing, denger air curug yang ngalir otakk jadi fresh, enak tempatnyanya di bawah juga sudah ada warung, jadi ga perlu bawa makanan dari luar,k alau weekend selalu padat pengunjingnya, perjalanan naik sama turun tangganya lumayan berkeringet 😅, tidak rekomendasi untuk usia di atas 60 tahun",4,neutral,neutral,positive,"Suitable for refreshing, listening to the sound of the waterfall flowing makes the mind fresh, the place is nice, there's already a stall below, so no need to bring food from outside. If it's the weekend, it's always crowded with visitors. The journey up and down the stairs is quite sweaty 😅, not recommended for people over 60 years old.","nature, atmosphere, place, food, crowd, transportation, accessibility","positive, positive, positive, positive, negative, negative, negative","waterfall, mind, place, food, weekend, stairs, people"
c45692c4b513470abb7d1e8cd7c6ef3a,2022-08-15 21:10:54,Curug Halimun,"Seru. Wajib dicoba. Jalan kaki ke Curug halimun nya turunan terus, jalan agak licin walaupun kering. Curug nya bagus, bisa berenang, warna airnya hijau. Perjalanan pulangnya tracknya naik terus.
HTM: 10.000
Sewa pelampung: 15.000

Paket komplit serunya dapet, keindahan alamnya dapet, bisa berenang. Mantap",5,neutral,neutral,positive,"Exciting. A must-try. Walking to Curug Halimun is all downhill, the path is a bit slippery even when dry. The waterfall is beautiful, you can swim, the water color is green. The way back is all uphill.
Entrance Fee: 10,000
Life Vest Rental: 15,000

The complete package offers excitement and natural beauty, and you can swim. Awesome.","walking, path, water, attraction, price, price","positive, negative, neutral, positive, neutral, neutral","Walking, path, water, natural beauty, Fee, Rental"
5da5c6f92e63412caa78efa289aee384,2022-12-15 12:39:05,Sarae Hills,"Datang di siang hari, parkirnya gampang, pas mau masuk nanti akan ditawari mau pilih dengan tiket jembatan atau tidak. Kalau pilih dengan tiket jembatan, kita akan diajak jalan diatas jembatan gantung warna merah, kemudian difotoin sama mas nya. Begitu selesai lanjut ke wisata yg ada dibawah naik shuttle.",5,neutral,positive,neutral,"Arrive during the day, parking is easy. When you are about to enter, you will be offered whether you want to choose the bridge ticket or not. If you choose the bridge ticket, you will be taken for a walk on the red suspension bridge, and then you will be photographed by the staff. Once finished, proceed to the attractions below by shuttle.","parking, ticket, bridge, staff, attraction","positive, neutral, positive, neutral, neutral","parking, ticket, bridge, staff, attractions"
09a9cf23d64648ef8076be0b2f1accb2,2023-02-16 17:57:25,Floating Market Lembang,"Tempetnya bagus, luas tempatnya palkiran juga luas.
Tempatnya sejuk, akses jalannya mudah.
Tapi sayang tempat ibadahnya kecil.
Kalo pas rame pengunjungnya ngatrinya lama.
Saran... Kalo bisa tempat ibadahnya di perbesar.
Tapi ttep buat keluarga floating market recomended.
Ni dah ke 3 kalinya ke tempat ini.",5,positive,positive,positive,"The place is nice, spacious, and the parking area is also spacious.
The place is cool, the road access is easy.
But unfortunately, the prayer room is small.
If it's crowded with visitors, the wait is long.
Suggestion... If possible, make the prayer room bigger.
But it's still recommended for families at the Floating Market.
This is my third time visiting this place.","place, spaciousness, parking, place, road, restroom, crowd, waiting, restroom, accommodation","positive, positive, positive, positive, positive, negative, negative, negative, negative, positive","place, spacious, parking, place, road, prayer room, crowded, wait, prayer room, place"
de3141b3e5ee411aa7c73b016a5bf7db,2022-06-15 13:29:17,Stone Garden,"tempatnya keren dengan banyak batuan karang purba
reminder aja. hati2 awal masuk stone garden banyak monyet liar. jangan bawa kantung kresek, karna mereka pasti ngikutin
lebih baik pake tas ransel kl mau bawa makanan
trus jangan lupa bawa buah2an ya. kasian mereka mengandalkan makanan dari pengunjung juga",5,neutral,neutral,positive,"The place is cool with many ancient coral rocks.
Just a reminder. Be careful when you first enter the Stone Garden, there are many wild monkeys. Don't bring plastic bags, because they will definitely follow you.
It's better to use a backpack if you want to bring food.
Also, don't forget to bring fruit. It's a pity they rely on food from visitors too.","place, crowd, crowd, food, food","positive, negative, negative, neutral, positive","place, monkeys, monkeys, food, fruit"
b37f85a6ef9b4c3fbae2965601e1fc3e,2021-02-23 18:04:47,Gunung Tangkuban Parahu,"magical.

harga tiket masuk 30rb per orang & 19rb/motor. yg biasa diakses yaitu kawah ratu. spot fotonya juga banyak, rekomen untuk sedikit effort jalan ke atas lagi karena lumayan sepi dan puas foto2nya.

untuk kawah domas denger2 dari warlok sana, harus bayar guide lagi karena lokasinya masih hutan2 gitu",5,neutral,neutral,positive,"magical.

Entrance ticket price is 30,000 IDR per person & 19,000 IDR per motorcycle. The commonly accessed one is Kawah Ratu (Queen's Crater). There are also many photo spots. It's recommended to put in a little effort to walk further up because it's relatively quiet and you'll be satisfied with the photos.

For Kawah Domas (Domas Crater), I heard from the locals there, you have to pay for a guide again because the location is still quite forested.","ticket, price, spot, quietness, photo, guide, location","neutral, neutral, positive, positive, positive, neutral, neutral","ticket, price, spots, quiet, photos, guide, location"
d894303103694a7d9b5b8aaf55650893,2021-02-23 18:35:13,Orchid Forest Cikole,"Cikole orchid park tempat yg sangat instragamble
Banyak spot foto
Di kelilingi hutan pinus
Recomen utk liburan brg keluarga atau pun org terkasih
Tiket masuk pun masih terjangkau
Dan SOP WHO msh di terapkan
Jgn lupa pake masker ya jg bawa handsanitizer juga jg jarak 😇😘
Happy weekend happy holiday man teman",5,neutral,positive,positive,"Cikole Orchid Park, a very Instagrammable place.
Many photo spots.
Surrounded by pine forest.
Recommended for a holiday with family or loved ones.
The entrance ticket is still affordable.
And WHO SOPs are still being implemented.
Don't forget to wear a mask, bring hand sanitizer, and maintain distance 😇😘
Happy weekend, happy holiday, friends.","place, photo, spot, place, ticket, maintenance, atmosphere","positive, positive, positive, positive, positive, positive, positive","place, photo, spots, place, ticket, SOPs, weekend"
